"Show","Date","Review","Rating"
"Arrow",2017-11-10," This show is ridiculous and unconvincing. Dialogues are awful, acting is bad and the script is insulting viewer's intelligence. Mother's secrets could have been a great show for itself and are, along with the island flashbacks the only reason I'm still watching. The bad guys and villains aren't scary at all, action scenes aren't exciting, some of the actors have a charisma of a cooked octopus when they're trying to be tough; that's actually funny from time to time. Absolutely the worst part are the relations between characters driven by kindergarten dialogues which are embarrassing to watch and listen. ","1"
"Arrow",2017-11-10," This was one of the best TV shows you watch for comic book genre, It started of great well lit up scenes with loads of action, suspense and a good story-line, suddenly all of that was thrown out and made a weak series in which the main character reveals himself all the time and the action is terrible to watch, no suspense, no general direction of the character, in almost every episode its the same dialogue  Oliver if you want them to trust you, you should let them know who you are, and Oliver takes of his eye piece and says  I am the Green Arrow  L.O.L What Dafuq.The show is just going down hill, specially that now the main character is now Felicity (sleeps with all the Billionaires and take their fortune and keeps them under her payroll) worst character, Thea Queen 2nd billionaire famous line  I am out . Just keep the group small and the action hardcore like 1st season, identity reveal yeah stop that, let the character start killing again, and please don't bring dead people back to make their own show.Season 1 - Great. Season 2 - Just OK. Season 3 - What is happening.Season 4 - Why are you killing the show. Season 5 - I give up, cant watch anymore. Season 6 - Stopped watching. ","7"
"Arrow",2017-11-07," The action of Arrow is awesome! but i feel that it has become a little boring because there is absolutely no humor, Felicity talks too much, and many other flaws. Thats why i give it a 4/10 rating. Otherwise, the series' action is perfect.#Flashfan ","4"
"Arrow",2017-11-03," This show is amazing and it gets better each day . Season 6 is spectacular. This is the best DCTV show in the Arrowverse. The show matures and grows each year . The leads of the show are spectacular and their chemistry is legendary . Great cast . Great story. Got a hold of this show last year and if I had blindly followed the haters remarks online, I would not have tried to check it out on my own . Guess what ? The show is amazing !! ","10"
"Arrow",2017-10-27," I really loved this show at first but its become very hit and miss as to weather an episode is any good or not. It started out great (8/10) it was kinda dark and ruthless but unfortunately the writers started emphasizing on the characters feelings way too much. Also the fight scenes although slightly better now became super cheesy and felt like I was watching power rangers around season 4.I really hope that they start focusing more on the villains and plot more again. Also it definitely wouldn't bother me if they killed off most of the annoying cast members. ","6"
"Arrow",2017-10-27," The First Season Of Arrow is a Great Season, it doesn't even feel like a superhero show (in a good way) the action scenes and flash backs are great and look like a scene from Mission Impossible or Kingsmen! The villain is top notch, the emotion is there, absolute greatness. Sure, it stalls here and there but that's expected when you have to fill 23 hours. the first season is great 8.75/10 IMOThe second is best so far, Deathstroke is the best villain, other than him the villain of the week's are also great e.g. the doll maker and clock king. the flash backs are also the greatest 9.5/10 IMOthe third season is where things go downhill, till the mid season it was shaping up to be great but after  The Climb  It became really mediocre, Ra's AL ghoul was an okay villain and the finale was really anti climatic. 6/10 IMOThe fourth is the worst. there is realistic feel to it, Damien Dahrk is a magician while Oliver is only an archer/hand to hand fighter. Thus the stakes are raised too high also Schism is the second worst episode ever. 5/10 IMOThe fifth season is a revival and is the second best season, Prometheus is a phenomenal villain and the stakes have been taken down a notch (THANK GOD) the finale is the best episode ever of Arrow, the only bad episode was  Underneath  and its quite possibly the WORST EPISODE TOO. 9/10 IMOoverall you will have a blast with the first two seasons, will have to sit through the bore that is season 3 and 4 and will be hooked at season 5, HIGH HOPES FOR SEASON 6 ","8"
"Arrow",2017-10-21," Like with Smallville and The Flash I have not seen every single episode but on some occasions, I do watch this show but only when there is a crossover or a certain actor in a particular episode. Like Peter Stormare who did good acting as Count Vertigo for two episodes and Matt Ryan who was John Constantine for one episode which was very funny. I also think Stephen Amell did great as Green Arrow and Felicity Smoke is pretty hot like Cathlin Snow from The Flash is. It is an okay show but it is not as interesting or likable as The Flash or Smallville. ","6"
"Arrow",2017-10-17," Every year Arrow is becoming more boring . 1st and 2nd Season of Arrow is very interesting great Story. But is seems after 2nd Season their are lack in Story Writing. Same old type of Stories Nothing new and interesting .As a fan of Arrow I am very disappointed and i expect more from Arrow. ","5"
"Arrow",2017-10-10," The first 2 seasons of the show was amazing however after that it got stale and boring. I decided to give up less than half way through season 5. The flashbacks become uninteresting. The villains after 2 seasons are boring. Love story is soap opera material. Season 4 made the show unrealistic with the sci-fi magic. Arrow was more interesting when he was working alone without any sidekicks. ","5"
"Arrow",2017-10-04," The first two seasons of Arrow were brilliantly done. The cinematography was illuminating, and it had a good plot. Somewhere along the line, though, the writing went south, and I know where we can point a finger to: Marc Guggenheim. It's bad enough that he killed off Laurel, but apparently, he wants another to take up the mantle. Rather than giving it to her Earth 2 counterpart, like any ordinary writer does, he gives it to a character named Tina Boland, whose real name is apparently Dinah Drake. Never mind that the real Dinah actually appeared before, and that she was Laurel's mother! I swear, I don't know how in the world these writers are able to find jobs. They suck at it. Then there's the Felicity relationship. Not a bad character, but when you focus on shipping these two together, when clearly, within the comic books, Green Arrow and Black Canary are an item from day one! And she constantly makes some of the most bone headed plays, yet Oliver never calls her out for it. He's such a wuss. He's not Green Arrow. Green Arrow is funny, witty and doesn't mope around. Stephen Amell is a good actor, but they should have stopped the whole Batman persona around Season Two or Three. They had a chance to make things right with Season Four, yet they come away from that one even worse. And they didn't even know who was going to end up in the grave. Really? You threw the grave plot line out there, without knowing WHO was going to end up in it? To this day, I still say William, Oliver's son, should have been the one who died. This would have made his fight against Damien Darhk much more personal. In fact, who wouldn't have wanted him to die? John Barrowman is a good actor, but they've lost all use for him. Oliver's excuses for letting him live fall flat when he sold out his son in exchange for protection. To me, that's unforgivable. I'm sorry, writers, but you have failed this show. If you want to keep me interested, fire the show-runners. Better yet, cancel the show, before you make things much worse. ","7"
"Arrow",2017-09-29," From the first season I thought that this show was unique and had a lot of promise; it was full of intrigue and frustrating characters who seemed to be neither good or bad in a way contrasting to so many superhero films/series. To say how much I enjoyed the show in the first and second seasons I was thoroughly disappointed from there in and yet I stuck around for two more seasons. The worst things about the show was how repetitive the villains became and how easily supposedly dead cast members were somehow brought back to life. I just wish this show had finished at it's peak after season two! ","6"
"Arrow",2017-08-11," I used to think Arrow was a great show until the first episode of season 3,that was when the show went downhill in my opinion.I first like seeing a dark version of the popular archer Green Arrow from DC Comics and seeing popular characters that were supporting characters of Green Arrow come to life in the Green Arrow's own dark story which seemed pretty interesting for the first two seasons.But when the show had it's season 3 premiere and it introduced Ra's al Ghul and more stories similar to other Batman stories started to be on the show,that's when the Green Arrow of the cw started to feel more like a parody and Felicity,his main love interest on The CW started to feel like her getting paralyzed and being named Overwatch was stolen from the story of how Batgirl/Barbara Gordon got paralyzed and got the nickname Oracle and fell in love with Batman.And I still can't believe the writers didn't mind killing of the Black Canary in season 4,who is the real main love interest of the Green Arrow and not Felicity Smoak. ","1"
"Arrow",2017-08-11," The action scenes are excellent and the story line if you are fan of super heroes in comics but the relationships between them are like the bold and the beautiful!like an American or Turkish soap opera!!!so beautiful faces with so boring personalities!!laurel??pffffff so predictable and flat as a woman!only felicity keeps the level up OK it is not game of thrones to have complexity in the characters but why so flat feelings?? P.S are we serious???im in season 2 and it's getting worse the romance part is awful soryyyy I mean stupid!!are the comics like this???mr director please this is not a soap opera!! PS2 at the end season 2 was much better and the love story between felicity and arrow seems the only real one!i hope to continue like this!!manu Bennett great performance as in Spartacus,he is a great actor he made season 2 more interesting PS 3 I quit watching at season 4...it could be a good show but unfortunately the script and the production are poor and in the soap opera's level...that's why I lowered my review to 4/10 What a pity :( ","4"
"Arrow",2017-07-27," I love superhero movies...I mean love em...I love Marvel and DC movies I do not have a favorite between the two I just love em both. I haven't read any comic books so I have to research origin stories and stuff. With that being said..The TV shows are a very different, which is to be expected. I still like some of em very much. Well I can safely say I really like the Flash. It is expected that superheros shows are cheesy I mean come on...sometimes the cheese on top makes it better. With that being said Arrow is to cheesy for me...I binge watch every show I watch and I watch a lot of shows (quite a range of em). The Flash, and Arrow do a lot of crossovers that is why I began watching Arrow so that I could follow that story line because of the cross overs. I am in to the 5th season and I just don't think I can I watch another a season. I will get through this one but my God! It is like the characters aren't growing at all. 5 yrs in to the season and Oliver is still the same whining, brooding woe is me character he was in season 1. How can he be so pathetic and at the same time be so cocky to think every thing that happens in the universe is some how his doing? Who is he GOD? The constant self torment, it is like be the Arrow or don't already! Kill or stop. At the same time every freaking season Thea has to go find herself. She loses sight of who she really is every season, come on. Who is writing this crap? Can she please find herself and be good? It has been 5 years what is going on? Of course there are the canaries. Can they just die or freaking live already? It is sooo ridiculous the same story written every season.The betrayals. How many times can Oliver MCQueen get betrayed by someone he trust before he learns to stop being an idiot? He is supposed to be the mayor and the Green Arrow protecting the city on two different fronts yet he is constantly trusting anyone who comes into his life and being played. Come on. A person has to have better instincts than that to run a city or be a super hero! This season with this new team!This new team is awful. I mean awful. There is literally 0 purpose for any of them to be with Oliver. They can't fight, they don't have any powers, their instincts suck. The only one that could do anything was the one with the suit that had power. Mr. Wonderful or whatever is good at tech stuff but who needs him when they have Felicity, except he is also good at being a punching bag. The Jason Voorhies want be is a terrible substitution for that other guy they had that Thea was dating (I am terrible at remembering names).I have started this season so I have to finish, but right now it is killing me. Every scene, and every episode so far is just so dumb. ","3"
"Arrow",2017-07-21," Arrow piloted in 2012. I loved the first season. Oliver Queen returns from his island he was stranded on and decides to fight crime because of his father and to make Star City better so he becomes the vigilante known as the Green Arrow. The first season was amazing and had a great plot. Stephen Amell had quality acting and the actors for Felicity, Diggle, and Laurel are all good. So I thought it wasn't going to get better. It got better. Season 2 was much darker and was highlighted by a new villain. It contained more quality acting and more Oliver flashback scenes. So after that I loved Arrow. But it didn't last. Season 3 wasn't necessarily terrible but it lost something about the first 2 seasons that made it great. It had a different vibe and it just didn't have a great plot. Season 4 gets too supernatural and season 4 is a low point for the series and I didn't enjoy it that much. I reluctantly watched season 5 which initially isn't great but by the end it recovers from season 4s problems. I would recommend this show but it's not perfect. It does have some weaknesses but it's a good show at its best ","8"
"Arrow",2017-07-21," I have watched four seasons, and this show has gone from great to fantastic! First of, I am not very familiar with the comic, but I have done some reading up post watching. The first season has a lot of introductions, explaining and character growth. The second and third season expands on this and while the good parts becomes better, the not so good parts starts to show more. Some say there is too much drama in the show, I say yes, there is drama, bu that makes the characters, motifs and bonds that much stronger any you get a real sense of what they are fighting for. By the end of the third season I felt like I was feed too much of an excellent meal, and really hoped there would be some changes until season four. I really got what I wished for! Oliver Queen finally starts to smile a lot more and leaves his previously troubled self behind. The chemistry between the characters is almost touchable and the fight scenes are simply amazing. Just watch episode 6 of season 4 for a great example. This particular shot just goes on and on without any cut. Simply breathtaking!Arrow is heavily tied to the Flash series so it is almost mandatory to watch them side by side in the right order. I personally don't mind this as I love Flash also. ","9"
"Arrow",2017-07-06," Arrow is just the show, you'd watch, when you are bored to death. Aside from that, this has the best background story, you'll ever experience from a life series. On the other hand, it gets milked by the present to an extent, where it just gets boring.Judging by the book, the Author really made a poor job. The setting, acting and everything else was just so there was a barely standing hero-series. => Normal guy becomes hero, kills and arrests bad people and has all the women he wants.=> Bad people wanna kill him and the women, he looses the women. => Hero stops them. => Hero becomes hyped, kills and arrests more bad people and has all the women he wants.Looping all the way to the end of the series.This kind of reminds me of Superman mixed with Robin Hood and Batman.Sure, there are some parts where I laughed and really got hyped by the next episode, but comparing to others, these moments were minor in arrow. As the 3rd Season started, I suddenly felt, why this series has such a bad reputation. Everything went viral, to complete confusion. The impression I got, worsened and kept its pace.For everyone considering watching a mainstream Hero-Vigilante-RobinHood-Richguy-Series. Why not just watch arrow? Considering that: I dare you to watch past season 2. ","8"
"Arrow",2017-07-03," If you're lucky you have yet to watch this horrible show. There is so much wrong with this show that I'm actually having trouble thinking of how/if I will present all the issues.First off, even if this show was well written (which it most certainly isn't) it wouldn't show up on screen due to the human statues that are delivering the dialogue. Stephen Amell is an absolute board. Sure, he's good looking but come on CW, he's terrible! It's as if the casting directors went to the nearest Abercrombie and Fitch photo shoot and chose the best looking guy to be their lead! Secondly, am I the only one who thinks that characters must have strong motivation to change? If characters make huge decisions as a result of small events those decisions are seen as cheap and meaningless. This show is the cheapest of them all.My third and final complaint (that I will list) is please stop recycling lines, it's gut churning.Unless you like poking fun at terrible shows don't go near this one. ","1"
"Arrow",2017-06-28," Arrow is certainly the best DC superhero TV show along with Gotham. Features DC characters such as Green Arrow, Deathstroke (the best of the lot), Black canary and Felicity Smoak!! The reason why Arrow is better than many other shows such as Iron Fist is because of the whole flashback and present thing that goes on... the way in which the show is made is unique and that's the best part about the show!!The 1st season is watchable but then the 2nd season arrives which is amazingly awesome just because of a single character and that is none other than Deathstroke!!Watch this one... it's amazing!! ","10"
"Arrow",2017-06-22," It was pretty alright at first, but is now a crappy show, with lame plots, and lot of boring and annoying characters. The fight scenes were alright at first, but they're trying to look cooler with no avail, with unnecessary spins and stuff, the action scenes are rubbish and hilarious, with awful choreography. ","1"
"Arrow",2017-06-22," Arrow may be the worst superhero show on T.V. Season 1 & 2 were good but after that it went down hill. The writing is terrible and the acting is worst. Everyone on the show is melodramatic. Everyone is so serious all the time. The writers constantly write the story into a corner and us The easy way out to fix the situation. Eventually everything become meaningless bc u know they will just take the easy way out. Ex: Magic pill , futuristic technology, dream sequel, secret twin and clones..etc. Plus the felicity can hack into literally anything in the world. She might actually be the strongest superhero in the show.One of the main characters was shot and supposedly was  permanently  paralyzed then in like three episodes the character gets a magic chip or something installed in their spine to magically heal themselves. One fake out is okay but the show only consists of fake outs. To the point that it becames predictable. Nobody ever dies except the fact that they have fake killed off every character on the show. Every arrow episode ever : actor 1 : I can't trust you. If u go ahead with your plan we can't be friends anymore. Actor 2: I have to. By the end of the episode problem is resolved and the gang is back together. Rinse and repeat ","2"
"Arrow",2017-06-21," I really enjoyed watching season 1. The story line had a purpose, I wanted to know how he survived and so on. The ending of season 1 was also great, but after that it just felt the story lost its momentum. Season 2 started with really nothing, everything sort of had to restart, and for me it couldn't. The nail in the coffin was when Sara Lance showed up apparently surviving the boat accident as well. Even though they showed the situation when she was lost at sea. After that it just fell apart for me and I could not watch a single episode. ","5"
"Arrow",2017-06-14," MAY CONTAIN SPOILERS Wow... Just plain bad... Green Arrow is the worst super hero (it pains me to write super) ever portrayed on screen... movie or TV.. yeah even worse than daredevil the movie and catwoman with Halley Berry... THINK ABOUT THAT FOR A SECOND!This show fails across the board... directing, acting, writing... But the biggest failure is demographic.. show is too stupid and cliché for adults but too serious for kids... Main protagonist is just a regular guy... like really nothing special about him (except banging everything that moves and abbbbsss), he cant even fight.. AT ALL... he gets his ass kicked in almost every episode by regular guys not to mention elderly.. And the message it send to younger audience is plain wrong... Its OK to harbor mass murderer as long as they are family??? What? Female protagonists are portrayed like emotion driven morons who cant think or do anything by themselves... Like every female protagonist cry at least twice per episode, there is less crying in soap operas... Ohh and the cringe worthy  drama  is the pinnacle of bad writing... This review box doesen't support enough words for me to explain everything that is bad with this show!I would not recommend this show for people with brains! (sry for my bad English its my 2nd language) ","1"
"Arrow",2017-06-13," I really liked this show up till the 3rd season. Then it seems it got infected with the SJW bug. Same goes for The Flash and Legends of Tomorrow Every episode has some cultural marxist spin to it. They had an episode about gun controlled that was so flawed it sounded like a twelve year old wrote it. They didn't think people should be allowed to by an AR-15. At the same time he has dozens of M-4's in his secret layer and two of the heroes go around shooting people every episode. The idea that the criminal mafia's and gangs would stop using guns if they were illegal is just one example of why they need to fire the writers. There is numerous episodes in which the women make sexist comments towards men. Of course the men just have to apologize for being born male. SJW's have destroyed movies, video games, and TV shows. There needs to be a great purge in the media and entertainment industries. ","1"
