"Show","Date","Review","Rating"
"Arrow",2014-10-03," *This is a review for the the Seasons 1 and 2 of Arrow *Minor spoilers for Seasons 1 & 2 presentAs you may know, Arrow is a show based off of the Green Arrow & The DC Comics Universe. As a big fan of the DC universe, I was a little sketchy after seeing bits and pieces of the 1st season on TV. In the short term it seemed like the Punisher with a bow & arrow, however that was before I sat down and watched the whole show.After watching two seasons of Arrow, I can happily say that Arrow is the most faithful live- action adaptation of the DC Universe to date. Sure it makes a few changes (the biggest being the characterization of Green Arrow), however over all Arrow has the stories, characters, super-powers, and the overall feeling of a huge expanded universe that DC fans have loved since 1938.The characters on Arrow are (for the most part) intriguing and faithful to the comics. Firstly, there is Oliver Queen, The Arrow, played by Stephen Amell. From the beginning, Oliver has a sense of mystery to him. At first he seems very different from his comic book counter-part, however as the story unfolds you begin to realize that he is headed there. It takes a few episodes for the actor to warm up to the role, but once he does, you begin to root for him and understand the decisions he makes. However, the Arrow does not fight alone as he has partners in John Diggle (David Ramsey), Felicity Smoak (Emily Bett Richards) & Roy Harper (Colton Haynes). Each character mentioned is a great character that adds to the show, and has you rooting for them as much as you are The Arrow. DC fans will not recognize Diggle or Felicity (unless your a die-hard Firestorm fan) as they are made up for the show. However, not to worry as they are some of the best characters on the show. DC Fans will of course recognize Roy Harper, as the Green Arrow's side-kick Speedy (or Arsenal or Red Arrow). Many fans of the show do not enjoy this character, however he is one of my personal favorite and I love what Roy adds to the show (he is also the only person to ever argue with Arrow, witch I love).That being said a show is only as good as it's villains, luckily Arrow has great villains. There have been many villains on Arrow, however I am only going to talk about the main 2 for the sake of time. (That being said, I must add that Deadshot, Brother Blood, Nyssa Al Ghul, & The Dollmaker are all great villains as well). The big bad of season one is (spoilers for any one not past episode 9) Merlyn, The Dark Archer. Merlyn's story is changed a bit. However, it is for the better as The Merlyn of the show is a much better character than the Merlyn of the comics. John Barrowman adds a certain charisma to Merlyn that makes you exited every-time he is on the screen. The villain of season 2 is (spoilers for Season 2) Deathstroke. Most of Slade's backstory is intact in the show. Even though his motivations are a little sketchy, Manu Bennet represents Deathstoke as the intimidating, venganful, and bad-ass character that we all know and love from the comics so all is forgiven.However, Arrow is not perfect. The 1st 7-8 episodes are engaging, but can be off-putting to some and not leave a good impression. However, I highly recommend that you stick with the show as it gets leagues better for the last half of Season 1 & All Of Season 2. The other main problem with Arrow is the Lance sisters, Laurel & Sara. It seems like the writer's just don't know what to do with Laurel. Although, Katie Cassidy tries her hardest to make the character work, the way the writers handle her is pretty brutal. I really hope they fix her for Season 3 (though they seem to be on the right track as I know she will be training with Wildcat). Sara has the opposite problem. The way she is written is usually pretty good, however the actress who plays her is just awful. Some of her line delivery is literally unbearable, to the point where she actually ruined an episode (S02E15, The Promise) for me.Overall, Arrow is a fun show and a great adaptation of the DCU that I look forward to watching every week, and I would gladly encourage any DC fan to check out Arrow to see there favorite characters such as The Flash, Deathstroke, Arsenal, The League Of Assasians, Deadshot & The Suicide Squad done justice on screen.*Also, I would just like to encourage everyone to like Stephen's facebook page as he is honestly the kindest, most down to earth I have ever seen. His donations to various charities is honestly amazing. Also, he reveals little tidbits of info on upcoming Arrow episodes as well. ","9"
"Arrow",2014-09-19," I wasn't expecting much from this show in the beginning, but I was pleasantly surprised. The scenes are short, tight and pack a punch. There is rarely a slack moment and the plot lines have considerable emotional resonance. As is typical of CW shows, it's full of gorgeous twenty- somethings with perfect cheekbones and impeccably coiffed hair, but that's just a bonus.In two seasons, Arrow has gone from strength to strength. The villain-of-the-week episodes are now interwoven with long-running story lines. Some of the second season episodes--Keep Your Enemies Closer, Three Ghosts, and Tremors--stand out as some of the best pieces of television in the last seven or eight years. Though they occasionally veer too far into comic-bookiness, the stories have become even more compelling<U+0097>in fact, sometimes I even wish there were more character scenes and fewer fights.It never ceases to amaze how the showrunners manage to squeeze the maximum out of a TV budget every single week. Not since Miami Vice has there been a show that aimed for--and so often achieved--the ideal of a TV series as an hour-long mini-movie, delivered once a week for the viewer's delectation. Often big-budget Hollywood movies feel bloated and weighed-down by all the money spent on special effects; Arrow is freed, its creativity stimulated, by the need to work within a smaller budget. The visuals are gritty and imaginative and the fight scenes are always wonderful to watch.Unlike most CW shows (ahem, Smallville) which aim for a more emo sensibility, or the angry-young-man nihilism which afflicted Nolan's Batman movies, Arrow strikes a more mature tone. Themes of loyalty, revenge, love, honor, family ties, sibling rivalries, friendship, betrayal, Oedipal struggle, motherhood, absent fathers, guilt, redemption, class struggle, the dichotomy between the mask one wears and one's true self, and more--pulp fiction it may be, but treated with loving care by the writers, showrunners, and actors. This combination of heightened emotional intensity with the comic book mythos elevates Arrow to something like opera: a world of stylized, epic, larger-than-life conflicts, but which is still recognizably human and compelling. And it's addictive.The powers that be at CW have fortunately renewed the series for a third season and I'm eager to see if they can manage to take the story of Oliver Queen to new heights. I hope the show runs as long as they can make it interesting. ","9"
"Arrow",2014-09-16," I watched  Arrow  for a bit and made it only until episode 19 of the first season. The concept of a guy who was trapped on an island and managed to escape it to fight crime is very good and exciting. During the episode they tell more and more about what happened on that island, which is a very good way of keeping the viewer interested in the show.But after a while I got really annoyed with the terrible acting in Arrow until the point it's totally impossible to take the actors and the storyline seriously.My advise is, try to watch the show. You will see for yourself if the acting annoys you. If you don't mind the bad acting then this is a good show for you. But for me it's a 5/10. ","5"
"Arrow",2014-09-10," Solid start to what could--and maybe should--be a future CW franchise. Your interest in Arrow depends on how much you miss the troubled-in-love, conflicted-by-family heroics of Smallville--it mirrors that series' setup. The pilot of Arrow is a darkly gleaming gem. If the show can keep up its cinema-quality action sequences and maintain an air of mystery to Ollie's agenda, this could be a really fun series. Arrow has a rather stylish neo-Goth look, and Stephen Amell (who played a dim-bulb gigolo in Hung) neatly balances his portrayal of Arrow between camp and Saturday-matinée ingenuousness. There's nothing particularly new about a superhero show, but Arrow exhibits a stylized ferocity that, in its initial hour at least, makes a positive enough impression. Arrow may not be a-point-meant television. But for starters at least, it's a sharper little tale than expected. ","8"
"Arrow",2014-09-07," I only recently discovered the series and just love Arrow! But love it even more when watching it on DVD, because then I can just forward through all of Laurel's scenes. I wonder if the creators feel sorry for the actress and that's why they can't kill her character? Hmmmm I sincerely hope they do though.Otherwise, nice action, some humour and overall fun to watch. Felicity is definitely my favourite character, simply because she's funny and nerdy. PS: I do not know the comics, so my judgement is purely based on the series. ","7"
"Arrow",2014-09-05," The first series was great with plenty of action and a reasonable storyline. Then in series two, the action scenes got sanitised and the storyline was adapted to reduce the amount of killing and the Arrow became an idiot whose snap decisions always play into the hands of the baddies. A pitiful storyline and plenty of overacting means episodes became cringe-worthy. I don't know exactly how these series are managed, but it seems that after the first series, Arrow has been assigned lazy script writers who judging by the amount of melodrama and teenage angst, previously wrote for 90210! Arrow has entered the realm of comedy with one character pointing a shotgun and calling somebody an  asshat , presumably for the benefit of viewers that get offended by strong language... sheesh! I got sick of characters second guessing themselves and entering stupidity loops,  Oh, if only I hadn't told that lie then everything would be OK, so now I'll tell another lie and that'll sort it out. Oh no, if only I hadn't told that second lie then everything would be OK, so now I'll tell another lie...  you get the picture... Repeated historical revelations used to provide storyline twists became tiresome, as they ended up being predictable as lazy story artefacts always do. Bottom line is that the IQ of Arrow has dropped significantly so if you're new to it, watch the first series then move on and forget it. ","5"
"Arrow",2014-08-27," When I started to watch the show I really didn't like the regular  story from the past  insertions. But sadly, after more and more episodes, those became actually far more interesting that the main story. Then I stopped watching. it really felt that I can just watch any episode in any order and I wouldn't even know if I had seen it or not. It was all so cookie cutter. The main character is not bad, but then it goes pretty down from there. Now I realize that the entire series was written by a bunch of 12 y o during their summer break. There can be no other explanation for the mind bogglingly inane  plot  that tries to carry this series through. Pap is too good a word for this garbage ! ","2"
"Arrow",2014-08-22," Great show! Arrow is a great mix of multiple genres, it is action packed and exciting, yet emotional and can be a little romantic. The casting in this show is so perfect, Stephen Amell is the perfect actor for Oliver as he is a park our expert and does all his own stunts making this show realistic. This show has a great soundtrack as well as a great catch line. You will find yourself quoting this show. There are those people that will say they don't like this show and I really don't understand them and wouldn't listen to them. This show is exciting for anyone, almost addicting! Overall this show is exciting and suspenseful, and a great show to watch anytime! ","10"
"Arrow",2014-08-14," If you take the time to notice, all of the bad user ratings are from users that only watched the first 3 episodes. The story has to be set up and of course the first 3 episodes of every show is a little rocky. Once the show gets in the mode of things and the plot develops, the show burns into an intense crazy fire of a plot that will be the only thing on your mind for weeks. It's a fantastic show with fantastic writing and a very talented and carefully chosen cast. Give it a chance. Though the story is very much not the same as the comic series green arrow, I would never imagine it any other way. This portrayal is very dense and contains many possibilities to branch out. Personally I think it is the best thing to happen to DC since Batman. ","10"
"Arrow",2014-08-08," Loved it.. watched all 46 episodes in less than 2 weeks! (and stayed up last night watching 8 episodes in a row!)Season 1 was exciting, but in Season 2, while the writers upped the stakes ante; during the last few episodes, Oliver/The Arrow began to become really foolish in his decision-making :( Your reticence to do what is necessary, is why your city burns!  To me, Nyssa summed up Oliver and Season 2 pretty well.While i love many of the supporting characters like Felicity, Roy, Sara, Tommy, Detective Lance and Diggle, it was really annoying to see how the skillful Oliver Queen turns out to be such an elementary playboy, (he actually slept with his father's mistress!!) and making more and more useless decisions that leave dear ones suffering. A disappointing lead character to root for. ","9"
"Arrow",2014-08-07," I am entirely surprised as to this shows rating. At this moment in time the rating is at a 8.2. This compared to a show like Deadwood which is at a 8.9.Now Deadwood was an examination in the creation of civilization out of a savage land. Filled to the brim with good actors inhabiting multifaceted and complex characters that touted amazing dialog.Could one expect some of the same from Arrow. One could but only with ensuing disappointment.I have now seen the first season and I won't be moving forward with season 2. Granted this 2nd season might take a quantum leap in quality. But I highly doubt it.As a lot have pointed out. Arrow is basically Batman Begins in TV form. This could've been exciting if it weren't for the huge difference in quality.I love characters. Unfortunately these characters pretty one dimensional even though they do evolve slightly over the cause of season one. Unfortunately they never really become real people because of their one note personalities. The show tries to create complexity but fails. It doesn't help that the actors for the most part aren't particularly fantastic. The chemistry between the supposed friends, lovers, family members also leave a lot to be desired. Needless to say I had a hard time finding a real character to empathize with.The dialog is very stiff and unengaging, which again doesn't help when the different characters are struggling with finding chemistry with each other.The plots are for the most parts predictable and clichéd. It's like the writers have studied a very traditional story model and lack the fantasy to try something new. There are plot holes abound and more than a few unexplained events.Not everything is bad. As the show does manage to create a hook for the viewer. A hook that would've worked better if the characters had been deeper and easier to sympathize with. The show reveals new tidbits about the main protagonists road to becoming Arrow for every episode. Which is a pretty good hook instead of the formulaic setup of finding a new villain for every episode.But for the most part this show, at least through season 1, is a lackluster and clichéd outing with one note characters and forgettable plot. ","3"
"Arrow",2014-08-06," Is it just me or this series is just going down the drain, every character is getting awfully WHINY as each episode is completed..... If it goes at the same rate, this show will probably take the honours of he WHINIEST show out there... When the show started off I thought it was just Laurel, but it was understood as almost every story out there has to have someone like that to make sure a segment of viewers stay interested. But then there was Thea.... even that was agreeable to a certain extent as she's a confused just out of teens kid. But then somehow the Lead character Oliver begins to whine about everything happening in the city is his mistake instead of doing what he was supposed to do ... WTH!!!! ","1"
"Arrow",2014-08-02," OK first, I'm assuming anyone who gave this series a 10 IS 10...as in years old.2nd...wow, how can something this bad be on so long? Acting, writing...meh, not a prerequisite in the making of Arrow. Apparently, just watching and ripping off Batman Begins, (and really...a bad rip off...can't even get that right) is all that's needed.Where to start.Acting: Apparently good looks trump any effort to act. I'd say they were phoning it in, but really, that would imply they have another gear. They don't.Writing: See Batman Begins....rip it off in many, many unimaginative ways.Target audience: 10 years old and less. Is there no law that protects them from this show? Parents, do your job!Please don't watch this show. It makes Dukes of Hazzard look Shakespearean. ","1"
"Arrow",2014-06-28," Arrow is a good live-action superhero show. Seems slightly unrealistic but what show about superheroes is ever completely believable. It feels like a fairly dark show but is nevertheless compelling. After each episode I keep wanting more.Super happy to see Willa Holland and Katie Cassidy back on TV after their respective shows ended. They're great young actresses with lots of style and beauty. As for the man-candy, Stephen Amell does a great job at portraying the sexy billionaire playboy Oliver Queen who sets out on a mission to clean up the city. Two words  Totally Hot! There is a big budget movie feel to the show but it is completely necessary to tell the story. It's a very solid addition to the superhero action genre. ","8"
"Arrow",2014-06-28," This show is by far my favourite show on television. It's a great new take on the green arrow storyline. The way they handled this new batman type green arrow is so great. The villains are perfect and so are the story lines that are used. Stephen Amell is perfect for the role and in my opinion is better than Justin Hartley. In fact the green arrow used in this show is better than the one used in smallville overall. After watching this show I would be really excited to even see a movie based off of this. A lot of episodes were handled extremely well like seeing red for example that is my favourite episode because of the epic feel that they were able to add in. While I was watching this show I was watching smallville at the same time and I have to say I prefer this show so much more. So I would definitely recommend you to watch this show the whole way through because it's just going to get better and better. ","9"
"Arrow",2014-06-26," OK, so this show is not high art or even art at all, but it's great fun and easy on the eyes. The plot gets hopelessly muddled, the dialog is downright silly, but who cares as long as Stephen Arnell takes his shirt off once in awhile. I do wish this show didn't take itself so seriously, would give the audience a little wink once in awhile.  Yeah, we know this is pure camp, but we don't care.  (Kind of like the old Batman, if anyone remembers) However, the actors keep up the facade that the world (or Starling City) is coming to an end, and the only answer to Bad Guys With Guns and Nuclear Weapons and Other Devices of Mass Destruction is One Handsome Dude with a Bow. Exploding arrows help too. ","7"
"Arrow",2014-06-23," It is not the best show on TV (that takes a LOT for me to rate something best), but darned good. It draws you in, is intense, intelligent, and gives lots of plot twists. Characters are believable, have flaws, and epic like in any super-hero universe. They go a long way to make it seem  realistic  - which I like if it's done well. My pet peeve, as a computer expert, is the computer feats are still squarely in the realm of science fiction, but that's OK - it's not overdone too much. (I wonder how much Microsoft paid for their Surface product placement?)Definitely worth watching, but beware - if you do, you will have to watch the whole thing or you won't be able to sleep at night! ","8"
"Arrow",2014-06-16," The only one thing that pisses me up every single time when i watch the series, and I do watch them all because other this problem the series itself is watchable.What's with the masks? Wouldn't you recognize your own sister or brother who is wearing nothing but a cloth over her/his eyes?! i mean Sarah talks funny and has a distinguishing chin mark and accentuates funny as well. Don't get me started with Queen! The chap is always with a beard thing just like when he is not the arrow and has that very distinguishing mole next to his lower lip! He is talking in broad daylight with everybody wearing a hood with his eyes covered, with the beard + the mark on his chin! I just find this hilarious, no effort put in to over think this matter and have them wear a proper disguise! I just feel silly whenever I see the Heroes talking to their families and nobody can recognize them, obviously the script won't allow them but normally you would of course recognize them entirely! Silly silly silly. ","8"
"Arrow",2014-06-15," Well to start off i want to say that i like the show, in general. The action is great, love the story too. But there are some things that really bother me. The interaction between the characters is just awefull. For example: They blame the main character that he's too selfish, too much of an asshole really. Guys... HE JUST CAME BACK FROM LIVING ON AN ISLAND ALONE, GIVE HIM SOME TIME!!!All the characters in this show are socially awkward/handicapped so it seems.If this show would have gotten some better writers for the dialogs and character development, this show would have a 9/10 ","7"
