"Show","Date","Review","Rating"
"Arrow",2016-02-11," This is not a bad series but not the best either. I gave it 5 stars for the simple reason of it not being original, trying to turn Green Arrow into more like Batman by using Batman's arch villains and the teen titans arch villains, and trying to make Oliver Queen more brooding like Bruce Wayne. Plus using one of the plot lines from Batman's history and using it for Green Arrow's was about sickening for me. Check out the end of season 3.Then there is flash back scenes that happen like every few minutes tends to be annoying. The multiple girl friend drama and the other excess drama tended to be writers block and ended up being filler to make the episode last for the entire duration.Now since I got that off my chest, if you know nothing about the comics then you might enjoy the series if you can get past the excess drama and half of the episodes being flashbacks. ","5"
"Arrow",2016-01-08," Another Comic Book Superhero show that gets high ratings because... its a comic book superhero. People are easily entertained, and by the 8+ stars this show had on IMDb there's no reason for Hollywood to change a thing. You can throw any piece of superhero garbage out there and people love it. I honestly believe if you made a comic book called The Hot Dog people would watch it.The Hot Dog is about a guy (Timmy Frankfurter) who works in a meat processing plant. The cooperate CEO's are having the lab work on a new meat preservative that the FDA is unaware of and has not been tested, but could make the company hugely more profitable. They accidentally leave some of the new preservative laying around and Timmy is accidentally injected. The preservative disfigures him, resembling a walking, talking wiener, but in turn, makes Timmy preserved himself, rendering him impervious to anything but fire. The Hot Dog shoots a relish like substance from his nose that sticks to anything it touches, thwarting any oncoming attack. Or he blows an onion-like gas out of his ears that burns peoples eyes, basically incapacitating them....Now, I understand that makeup and CGI will have to work on a Man/Hot Dog with ears and a nose, but I'm telling you people would watch it. Just put in a couple outlandish-looking weapons, 2 or three big explosions each episode, and finally (of course) 2 hot girls making out and I guarantee 3/4 of the reviewers would give it 8-10 stars. They'd write crappy reviews like,  Original. I was entertained and strangely hungry throughout the entire show.  or,  I felt for the Hot Dog and his inner battles. It reminded me of my battles choosing between ketchup and mustard...  I once heard someone say that people will applaud anything, and it is so true. People are entertained because they think they were supposed to be entertained... People, it is okay to actually think.BTW, If anyone wants to by the rights to The Hot Dog, please contact my agent.So, to my long awaited Arrow review.... It sucks! ","1"
"Arrow",2016-01-08," Arrow is successfully disappointing in every aspect that I could think of: (big spoiler alert!!! )1.Directing- The scenes are poorly directed. Lets start from the poor performance of the characters which I believe could have done better with another director. For example Oliver (the Arrow) is believed to be dead for 5 years, when he comes back home from the dead he get a soft hug from his sister (Really??? a hug ??? you could think he went on a bushiness trip and came back), don't get me wrong I'm not looking for much emotions in this series but this is a poor understanding of the situation. Other then the performance the scenes are just not professionally filmed! another strong example is at one of the scenes Oliver is talking with his mother not arguing of fighting but using cold sentences to each other) and all of a sudden his sister ,which observed them from far distance, claim that they had a fight (OK maybe she can read their lips). there are so many scenes that I can give you but you got the point and I should continue to the next thing. Second thing which keeps going all the time is that the Arrow is using arrows and his enemies using guns,automatic weapons and they keep missing the target.As far as I can tell the arrow doesn't have a super dodge ability, and it seemed too lame that police officers, S.W.A.T teams and special forces soldier all miss the Arrow and even the camera angle doesn't let you thing that there is a far distance between them (oh God this is insulting). Third thing is that many time the Arrow is hunting some evil guy and they seem to miraculously disappear right in front of him!! (OK maybe he is not that a sharp hero).2.Plot development- OK this even worse the the poor directing. for a whole season Oliver is murdering people who allegedly corrupted the city.He is the judge and the executioner (Ok this will change as the series goes). but what really bothers me is that most of the characters around the Arrow doesn't seem to worry about the killing spree .Only 2 characters does, and only at a very late part of the series. Another thing is that there are 3-4 enemies that keep come back at the first and second season. I love when a character is suddenly comes back to the series but this is happening too many time!! with the same characters !! come on the DC universe has plenty of villains, use them! Another is that the Arrow identity isn't kept as secret as you expect, at some point everyone knows who is the Arrow except new villains. One last thing that shows again how the plot is poorly developed is that the characters had done some terrible things one to another (cheating, lying, kidnapping,drugging, murdering ) but they somehow in an unreasonable way forgive each other or even worse - help each other (!?!?). I could keep on criticizing this series and keep on with the spoilers (the big one is at middle of season 3 which I decided not to mention here) but if you read this far you probably make up your mind already so Ill save you from more spoilers/criticizing .2 good things I have to say about the Arrow (the reason why I rate it 3/10 and not 1/10) 1.The connection to the DC comic world by joining interesting character to the series (especially joining forces with another TV series. A step I think had never been seen before on the screen). but this happened too late I suppose to save this poor series. you probably ask yourself why I keep watching this series, only to understand another good, amazing, thrilling and Flashing series. 2. Villains that are though enough to beat down the arrow - this is comes only at the middle of season 2 and season 3 but it surely add a lot to the emptiness of this series . and of course the Arrow ridiculously defeat them somehow thanks to the director.In a sentence - this series could have been much greater, but it managed to be a disaster (i.e the Arrow character at Smallville was way much better). this is a real insult to your intelligence. think twice before staring to watch this big disappointment. ","3"
"Arrow",2016-01-07," A lot of the reviews for the show say that Arrow isn't any good because it's repetitive, unoriginal, poorly-scripted, etc., and I completely disagree. THIS SHOW IS ABOUT HOW OLIVER QUEEN BECOMES THE GREEN ARROW. It's meant to be an origins story, so I agree when people say the characters (especially Oliver) make the same mistakes more than once, but it's supposed to be that way. This show is meant to portray how Oliver Queen went from being consumed by darkness (as Arrow) to being a symbol of hope for Star City (as Green Arrow). Oliver has a really messed up background, and this story tries to explain how he overcame his definite trust issues and overbearing protectiveness to BECOME A HERO. I never read the comics or anything like that, but my main reason for loving this show is because of the character evolution. It's crazy to watch the current season and go back to watch the first episodes of season 1 because the show is so incredibly different now. Oliver has gone from being a murderer to becoming a hero, and that means the tone of the show has changed entirely. Something else you have to remember when watching this show is that it's television. Every show (especially the ones on the cw) needs drama to survive. You have to keep the show interesting, and the characters have to be doing something new every season, or it'll get stale. So far, the writers have done a pretty good job at this. They do recycle old material ever now and then, but they've done an okay job so far. I will admit that the first couple seasons had a lot of filler episodes, but so far in season 4, there haven't been many (if any at all) that didn't directly go back to main big bad of the season. There have been a couple that were meant to set up the new show Legends of Tomorrow that I could have lived without though.I will agree with other viewers when they say the show can be inconsistent because there are a couple of things that tend to get annoying. Like Laurel Lance. The character doesn't serve any purpose that someone else can't fill, and I'm still trying to figure out how she got so good at fighting within like 5 episodes. And is she even a lawyer anymore? Things like this are why I couldn't give the show all 10 stars. All in all, though, Arrow is one of my favorites, and I'll continue to watch it until the series finale. ","8"
"Arrow",2016-01-03," If you want to watch something entertaining, captivating and exciting then you must watch this. But keep in mind this show does not fully satisfy the most solid-reasoning demanding minds because there are events lacking logical explanations that make this show somewhat inconsistent.If it was not for these flaws, I would admire this show more, but even so this is worth the opportunity to be watched for one or two episodes to make your own opinion.The acting is good, not great but delivers what is supposed to. However, the actresses involved in fights should be more fit if we are expected to give more credibility.Most of the fighting moves are better than for example Daredevil (which is quite great overall) but there are still some moves that need to be practiced more.Production is OK for the budget but I would like to see more realistic explosions not those Power-Rangers-like sparks.I want to recognize and thank the writers and everybody involved in this show because I think it is not easy to entertain us watchers for 4 seasons so far and have good ratings. ","8"
"Arrow",2016-01-02," In season one the Arrow is just a murderer, plain and simple. The acting is bad, the characters are bad and unrealistic, it's pretty much a soap opera.He has an  enlightenment  by the end of S01 for no apparent reason (much like Ben Affleck in daredevil) so at least that part gets better by season two, since he stops murdering people, but almost nothing else changes. The acting is still cringeworthy, the characters are still pulled straight out of Santa Barbara. I don't know why I stuck with the show until halfway through season 3, but I did and it doesn't get any better.The action is fun I guess so the show has going for it but other than that, it's really no good (it's certainly not an 8.1 in my book). ","5"
"Arrow",2015-12-31," Great...Really Great in TV Series World...Only 1 Star is less because of this described below...But Why this Great story has unbelievable behavioral pattern. It is obviously feel that even matured superhero keeps secret a thing which he should not and gets result as worst And also accept after every time that I should have told earlier (Most spoken Dialog after You have failed This City Dialog in Whole Season). Lets think its okay for 1st time but frequently after this he is doing same mistake which is mismatch to matured character (Even Child can learn that this should not be done again). Also Laurel & Thea making mistakes every time and didn't learn things from their mistakes which is also feeling an Idiot to me watching this And in this scenario Arrow knows what is right and wrong and even after he forgives and not doing any precautions or making strict steps which must be required like it was a child's mistake. Make it real if you have such a great story and Superhero. Arrow can't be loser in this normal action after surviving 5 Years. Everyone keeps secret from each other and also alleging each other when others secret comes out. They are not children to unable to evaluate this even by series of experiences. Laurel & Thea are always making things worse and Arrow is not learning from this or even doesn't try to them not doing again. ","9"
"Arrow",2015-12-20," Entertaining at first simply because we all want to know what happened on the island and how he managed to survive but they show us slowly, teasing with bits and pieces of the past that will either intrigue you or cause you to give up on knowing. I understand that it's part of the  mystery , not revealing the entire 5 years of his disappearance but it's starting to feel as if they are keeping us in the dark so they can use the past to introduce whatever crazy plot or storyline at any given time.There's action and entertainment I will admit but later it gets so repetitive that you will be able to guess the outcome before it happens. Also, there's the irony of him always  lying to protect  his loved ones in which , the lies cause more damage than the actual truth. Half of the bad things that happened wouldn't have had he just revealed his identity. Entertaining on a Sunday with no cable ","5"
"Arrow",2015-12-18," As a Chinese, I have to say the Chinese people (except the Sichuan restaurant guy) are FAKE Chinese. The Chinese accent from them makes me feel disgusting. Really hope they just find some actors and actress who are a real Chinese, not a BANANA anymore. As a Chinese, I have to say the Chinese people (except the Sichuan restaurant guy) are FAKE Chinese. The Chinese accent from them makes me feel disgusting. Really hope they just find some actors and actress who are a real Chinese, not a BANANA anymore. As a Chinese, I have to say the Chinese people (except the Sichuan restaurant guy) are FAKE Chinese. The Chinese accent from them makes me feel disgusting. Really hope they just find some actors and actress who are a real Chinese, not a BANANA anymore. ","3"
"Arrow",2015-12-15," Major Spoilers Ahead!Only up to the 2nd season...so far 1/4 of the show is about childish tantrums and drama worthy of a soap opera. At least the whining was covered by both sexes in the first season, but with the death of the stooge Tommy (good riddance) most of the whining comes from the female characters (except Sara). Moira's slightly condescending reaction to her daughter professing love ( I love Roy ) summarizes the feelings about the inane subplots: Roy who? I said  stfu Thea  out loud at least once every episode in the second season.The best part of the show is the flashback plot that explains Oliver's time on the island. The villains aren't always a hit (The Count), but most of them are portrayed well enough both in writing and acting. ","6"
"Arrow",2015-12-15," i love this show so much season 3 was my personal favorite because of the story lines but all 4 are amazing. If you are looking for a good action, adventive, drama, sci-fi show then 'Arrow' is the show for you,also if you like 'Arrow' then you should watch 'The Flash' because they cross over and have good story lines. In the show there is an amazing romance between 'Oliver' and 'Felicity' there ship name is 'Olicity' i think they are an amazing couple and have shipped them since the beginning of the shoe when Felicity was first introduced. 'Roy' and 'Thea' also have an amazing relation ship and both join Oliver's team to help fight 'Slade Wilson' and 'Deathstokes' 'Mirakuru' soldiers. ","10"
"Arrow",2015-12-07," 1. Okay, I'm a guy that LOVES to sleep around, but the characters in this show sleep around so much it makes the girls look like total sluts. Every time Thea or Felicity or Laurel gets to meet a new character introduced into the show, they are asked out on a date and end the date humping2. So much inconsistency. At one point, two characters are best of friends / family and nothing on earth can break that bond, then next minute they're enemies. Seriously, I think the writers are 5 year olds on crack to write a show like this.3. EVERYONE becomes a super hero. The main character's lover, ex- lover, sister, hell even the next door neighbor's dog becomes a super hero (okay that last one's a joke but seriously...) Is it really that easy to become a semi-invincible god like fighter? And what is up with all the female fighters? I mean I'm not sexist or anything but please at least choose women who can do the choreography right. When Laurel Lance fights... it is... absurd to say the least. You can literally see her doing the  girly girl swing  with her punches. If they chose Ronda Rousey to do the action scenes, at LEAST the fights would be memorable, but the producers messed that up too.4. In summary, this is the most absurd, bad action, bad acting, stupidly put storyline TV show I've EVER watched, and I'ved watched TV for over 36 years, in 8 different countries. ","1"
"Arrow",2015-12-07," Fantastic show. I always look for solid character development in every movie or TV show regardless of genre and this show definitely brings it. The action scenes are great, don't get me wrong and I am sure that a majority of the audience is in it for those scenes. And the story line is likewise fantastic. However, what really hooks me is the constant traits of friendship and sacrifice that is prevalent in the show. Each member of the team would offer themselves as a sacrifice for one another time and time again. Even in Season 3 when all hope seems lost, Oliver is still trying to save his friends lives in exchange for his own life. Over all, I love the show. ","10"
"Arrow",2015-12-06," This show is amazing! The actors are great, a lot of great scenes, a lot of people were q tiny bit disappointed by the 3rd season (i am not one of them) but clearly they are not anymore thanks to this amazing 4th season! I love the story, the crossovers, the fight scenes, keep up the good work! Every time I watch an episode i cannot wait for the next week to watch the next one. I love Arrow, Stephen Amell is one of my top idols with his acting, him being a hero on TV and in real life (F*ck Cancer) and his amazingly perfect body...I wish I can meat you one day. I also cannot wait to watch TMNT 2! Please keep Arrow going for as many seasons as you can. *SPOILER ALERT* Try to shoot scenes that only involve OTA (Original Team Arrow) more often just like you did in an episode in season 4 that i adored!Thank you! ","10"
"Arrow",2015-11-30," I really do not understand how this show has an 8.1 average. Sometimes it is so difficult to fathom how the writers came up with such a clichéd TV series. Now don't get me wrong, I am all about clichés and cheesy dialogues but this show has taken all of those aspects to a whole new level with an extra strong added ingredient of  stupid .For example, Sara Lance comes back to Starling City, and just because she wears a tiny eye mask, her own sister cannot tell it's her? And what's with the cheesy  Mirakuru ? It would have sounded much less cheesier if they had called it  The miracle drug  or something like that.Another example, is when Thea Queen get's kidnapped by Slade. If you get  KIDNAPPED , you'd be fearing for your life. I mean did Thea know that Slade was not going to kill her when she was first abducted? She would have been quaking in her boots and traumatized, to say the LEAST. Yet when she is let go, the only thing she can dwell on is the fact that Oliver didn't tell her the truth about her father? Really? Wouldn't she just be happy that she  STILL HAS HER OWN LIFE ?Things like this keep bothering the hell out of me, and the ONLY reason I watch this show (albeit while biting down on my tongue), is because I want to know how the story fits with The Flash, and all the good TV shows have been watched already.If you don't care about whether a TV show makes sense, or care about storyline, or decent action, then go ahead and watch it, but for me... I'm awestruck at how stupid a show they can make.Some GOOD TV shows I can recommend:- Person of Interest- Da Vinci's Demons- The Blacklist- The Flash ","2"
"Arrow",2015-11-29," I actually enjoyed the first season of this show. I can suspend disbelief for any fantasy that is reasonable( zombies in Walking Dead that can be killed just with a spike to the brain? No problem). I even could overlook the unlikely fact that Oliver becomes a world champion ninja warrior on the island. But then came the real insult to our intelligence. We are expected to believe that his skinny kid sister (Thea) and even skinnier ex girlfriend (Laurel) can become amazing ninja superheroes with just a few months of training sessions. Suddenly they can beat most beafy badass men in a fight??? WTF???? Why is no one talking about this???Fail That's when you lost me. Sorry ","2"
"Arrow",2015-11-29," Except for its first season the show is no more any hero story just pathetic sex and city type and while reaching 4th season only thing that remains is killing and resurrecting lead roles.It makes you even on an account of thinking about your time and money waste.Much sillier plots can have amazing show but this gives no intention to watch further. Why do you just have to revolve story around silly natters of relation among the lead roles instead of a hero doing at least a bit productive.It's just a silky drama for people to watch and cry until no reason has left in them.No thrill or action just a story of a man of who is rotating among his friends and family problems and has no time for good action. ","2"
"Arrow",2015-11-27," OK this series is a whole lot better than any TV shows I've seen. This a thrilling TV show and very catchy. Just get through half of season one and you will love it. I love the how they leave you thinking of how people knew Oliver before he came back from the  dead . I'm currently watching it on Netflix and can't wait till season 4 gets out on Netflix. Love this show cause it is somewhat realistic. It can come true. You just need to be a really good archer and need to be good at everything that Oliver queen is on this show. I hope the Arrow series will continue on for 6 seasons. I guarantee if you like watching action shows you will love this show. ","10"
"Arrow",2015-11-27," I somehow endured 3 seasons of this, just because I had nothing to watch. It's not even THAT bad if you think about main story line, just a relaxing show, everything is pretty mediocre, but the main problem here is... Fillers. 23 episodes each season, about 7-8 of them are actually tied to the main story line, rest of the episodes they're dealing with maniacs, serial killers, robbers, drug dealers etc. It's totally pointless, cause you always know who will win and you always know that no one from the  good guys  will be seriously hurt/die in the process. Later it gets even worse - they're re-using same filler characters, they magically resurrecting, escaping from prison and other bs, but at least you're aware right at the start of an episode that it's going to be a lousy filler yet again.Really don't understand why they need to make 23 episodes each season when most of them filled with stuff like I described above. It's really painful to watch and kills any amount of hype so that you don't even care about main story anymore. ","2"
"Arrow",2015-11-25," This series is really not my kind of stuff : it's clearly make for teenagers.  Heroes  that can rebirth, killed but never dead, injured and wounded but always standing still, etc... I have seen the 3 first seasons because of my ex-flame was watching it every Wednesday (at 11.30 PM!) when it was aired in France on TF1. I was so bored watching this thing I often fell asleep in front of the episodes ! I just don't get the point. Superheroes series can be well-made. But this one is so dumb. If you like it, well it's just fine. But I really don't and I won't see the 4th season when it'll be aired in France next summer ! And please, the acting !!! Come on ! Start acting, not taking poses for the cameras ! I think why the producers chose Amell is only for his good looks. Not because he's a good actor... And the series... Season after season, we always have the same scripts coming from the first season's episodes ! Arrow wins, Arrow loses... He wins, he looses... He wins, he loooses... Someone died ! He wins, he looooses... He wins, he loooooses... He wins, he looooooses... Oops, another one died ! He wins, he loooooooses... He wins, he looooooooses... He wins, he loooooooooses... He wins, he... OH my Goash : I see Dead People !!! OK, Arrow is still alive... But for me, this TV-Series is already dead.Arrow ? Never more for me ! ","3"
"Arrow",2015-11-23," I stomached S1 on Netflix and I mean I was laughing hysterically at the sketch comedy that occurs on the island scenes. I mean, that is just overtly cheese...The Bruce Wayne wannabe gets his ass handed to him by non meta-human adversaries on a daily basis. I have no doubt that trogs will continue to watch this trash and keep it on the airways, so unfortunately I will stomach the bad acting and mediocre plot line because I'm a glutton for bad cinema.I hope the CW eventually merges this into the Tyler Perry universe where Oliver Queen is forced into slavery in an ironic twist and forced to marry his black bodyguard, who is a dude. In short, watch this at the risk of not liking it, and continuing to watch because network TV blows in general. ","3"
