"Show","Date","Review","Rating"
"Arrow",2013-10-13," Been watching Arrow since it was first released. Didn't know what to expect as never read any of the comic books but did know the Green Arrow. After seeing the trailer I thought this looks good so gave it a go. All I can say it  WOW . Great character development, good acting, great fighting choreography and Stephen Amell plays Oliver McQueen really well and portrays him as a vigilante. I know understand more about the Arrow universe and like the fact that there are flash backs to the Island which let us as the viewer know how Oliver become who he is after returning back to Starling City after 5 years of everyone presuming he was dead Am hooked on Arrow now and glad that season 2 is now underway. ","10"
"Arrow",2013-10-09," Following up in the footsteps of  Smallville,  this introduces viewers to another DC character. However, Green Arrow has a much darker outlook on crime fighting and a shadier past than the Man of Steel.Arrogant billionaire playboy Oliver Queen accompanies his father on a boating trip aboard their luxury yacht. After the ship sinks and everyone on board dies, he's left to fend for himself for five years on a remote island. While there, he encounters a deadly band of mercenaries setting up for an attack. He partners up with another castaway who teaches him the art of war with a bow and arrow. Upon his rescue, Oliver returns to his home with a renewed passion in life. He will rid the city of its criminal elements using his newfound skills as a vigilante archer.If you're expecting  Smallville  going into  Arrow,  you need to get that out of your head right now. It's much darker and rooted in realism. Where Clark Kent had issues with offing villains, Green Arrow doesn't think twice. He's closer to Batman than Superman in attitude, although the Dark Knight doesn't believe in killing either. That's probably why they decided to re-cast the lead character and steer as far away from the Oliver Queen and hero we saw in the sci-fi and fantasy-heavy  Smallville. You won't find any meteor freaks or meta-humans in  Arrow,  either. The villains and other heroes Arrow runs into are all rooted in reality. Think Christopher Nolan's  The Dark Knight  Trilogy versus Zack Snyder's  Man of Steel.  Arrow  takes some time building up, but the wait pays off. It's a slow- burning drama with characters the writers flesh out enough that you actually care about them. Some of those characters will be familiar to viewers who follow the comic book. We get appearances by the Huntress, Deadshot, Deathstroke, Roy rperHHarper and Laurel Lance. To comic book geeks, it's common knowledge that Harper becomes Speedy/Red Arrow/Arsenal and Lance takes on the alter ego known as Black Canary. It's treats like these that give hardcore fans a lot to smile about.  Arrow: The Complete First Season  is not rated. I would give it a PG-13 rating because of adult situations, violence, and language. It's a prime-time TV show on a major network, but it still dives into a some mature content children don't need to see.  Arrow isn't only for comic book fans. The writers for the show do a great job establishing characters and a universe that anyone can enjoy. It's a slow-burning drama with enough action, mystery, and suspense to keep audiences coming back for more. Although it gets off to a slow start because of character development,  Arrow  successfully picks up and ultimately pays off with a great second and third act. ","8"
"Arrow",2013-10-07," Borrowing heavily from Christopher Nolan's  Dark knight  trilogy, and  Batman Begins  in particular, adding in a cast of uniquely annoying Americans, a load of flashbacks, and a highly improbable character, who the writers are even afraid to refer to by name,  Arrow , to me, is quite simply magic, in the truest sense of the world. Because, for some unknown reason, it's an incredibly good series, with a finale which left me gaping. Not even  Fringe  could do that.So, what's the secret of the green guy with the bow then? How do soap-opera heavy story lines of bickering families full of people with massive egoes, and very little acting talent, with the thinnest scraping of urban street fighting, make for such an enjoyable run of episodes?First off, the first three episodes are quite frankly terrible, and nearly destroy the entire concept. But, persevere, and you will be richly rewarded. From episode 4, things pick up considerably, until they reach a climax of perfection with The Huntress' two parter - episodes 7-8, and episodes 9 and 10 are consistently good. Then, the whole thing sort of goes off track again, with complication upon un-necessary complication, and the Robert Queen journal is put into mothball, as Oliver kind of forgets what he's supposed to be up to, and fights random, usually quite annoying criminals, like The Count, the absolute nadir of the show. The two part finale, whilst literally ripping off the exact plot of  Batman Begins , is suitably epic in scale, and delivers shock upon shock, and made me realise that I'd enjoyed this show more than any Marvel film. This, is the way forward, one of the few Nolan clones, which works.As for the cast, Stephen Amell is someone you will grow to like, as he gets more comfortable in the role (He's definitely rather weak to start off with, in those crucial first three episodes), but most importantly, whilst not being a brilliant actor, he is a likable enough personality. The star of the show, in terms of acting, is David Ramsey, playing a half Dr Watson, half Alfred to Amell's vigilante. Ramsey is charismatic, and totally at ease in his role, easily the best actor in the show. Katie Cassidy playing Dinah Laurell Lance, is annoying, and prone to bouts of whinging, which get on your nerves, as does Willa Holland, Queen's younger sister, who at times, is the most annoying person in the show, hands down. Colin Donnell, playing Tommy Merlyn, Queen's best buddy, is another talentless effort, who stumbles through his lines like a robot. Susanna Thompson - pretty much the same, but less annoying. Paul Blackthorne, playing the unwashed police father to Laurell Lance, constantly poses, and doesn't have a genuine bone in his body. Cotton Haynes, as a juvenile delinquent version of Roy Harper, the same. Emily Bett Rickards, as convenient plot gap filler, Felicity Smoak, a computer nerd, is again all show, but mildly charming in a deeply irritating fashion.The guest cast, thankfully, is better - John Barrowman is an excellent corporate main villain, and even Alex (River Song) Kingston shows up as Laurell's mother. For comic fans, you'll get the pleasure of seeing a brilliant rendition of Deathstroke, a less brilliant Deadshot, a pretty cool, but totally changed Royal Flush Gang, and Kelly Hu's China White. But as I said, the highlight is most definitely the Huntress - played with style and panache by Jessica De Gouw.The series makes extensive use of flashbacks to Oliver's island ordeal, and a rather implausible storyline about hired mercenaries, in which Olly's going to learn to do his thing. More training, and less killing tons of guys in black balaclavas would be nice, but who can argue with Deathstroke, the most awesome thing in the whole show? Shame he's killed half way through. For series 2, I'd like more ideology, and symbolism in the island stuff, counteracting the action in the main narrative.The story lines are generally very character driven, with around five minutes of arrow packing action an episode on average. Not much, but generally worth waiting for, because the fight scenes are well worked out, and generally exciting, in spite of their Dark Knight style editing. Acrobatics and parcourt are used extensively, to give a functional feel to Oliver's combat system.The characterisation tends to suggest that all these characters are very narrow minded, as they continually over-react to the smallest things. A lot of ego-trips, posing about, and people coming out with things like  Stop Judging Me! , and  I'm not who you think I am , and  Why did you lie to me? , as well as just about the entire cast at some point telling Oliver that they wished he'd died on the island (including Olly himself in the last episode.) All rather tiresome, but there's some nice ideology in there too, as well as perhaps the closest match to an actual comic book feel I've ever seen for any superhero adaptation,with tons of dilemmas, and secret identity crises. To be honest, it feels a lot like seventies and eighties Spider Man comics. Not bad at all. So, overall, it's definitely a grower. Maybe they never call him Green Arrow - instead opting for the likes of  Hood Guy  (Yeah, THAT sounds cooler...), but it's an earnest, and enjoyable show, even if it does fluctuate rather in terms of quality. Put it like this, I'm looking forwards to Season 2 considerably, and, whiny soap opera or not, it's got a lot more character in it than Marvel movies. Hopefully, Arrow will be the way forwards, carrying the Nolan torch into a dark urban world, and giving us a ray of hope. A work of art? No. Entertaining? Undoubtedly. ","8"
"Arrow",2013-10-02," I just finished watching season one and I'm looking forward to the start of season two. I think this show gets better as it goes. At first, it was hard to get into because it seemed overly dramatic and kind of soap opera-ish. The characters were rather hard to believe, but I liked the story so I stuck around. As time goes by, it's easier to buy into the characters. Some of the acting is lacking, but that also seems to get better with time. There are a couple things that are very predictable, and I found the back and forth with Laurel a bit obnoxious. There are times that call for a certain amount of suspension of belief, but it's a show about a superhero so it's hard to complain about that.Overall, I find some things about this show annoying, but I still want to know what happens next. ","7"
"Arrow",2013-09-30," Well sorry for giving u 9 , I mean the episodes are awesome, story is awesome , characters but u lack with some characters u know ... DC Comic G and the gang ..... OK that is essentially why i gave u 9 ..... Accept for Roy Harper that i hope will be one of the main characters in new seasons ........Well to summer my review u need to get other characters from DC Comics that where in it with Green Arrow that is all ..... So , all the other Super Heroes will be shown i new seasons , as well as Super Villains in some episodes of new season ....... Thank u for Screening The Arrow and hopefully i will see the new seasons soon :) ","9"
"Arrow",2013-09-23," There's not just a single season for why this series could have a higher than 4 over 10 rating, well perhaps the only 1 reason could be that u just never saw a really good series.Starting with the story and plot that develops so predictable and immature, without any real drama or suspense, and a regular to fake action sequences. The script is full of clichés & weak lines that complement the bad acting from almost all the  actors  starting with the worst one: Stephen Amell the protagonist. If that's not enough, the FX, lighting, song choices, even the wardrobe and interiors design looks and hears cheap, without any kind of quality in the whole thing. ","3"
"Arrow",2013-09-22," As much as I can easily watch this, there are two things which stand out for me: Shameless product placement (we're looking at you Microsoft) and the unbelievable amount of makeup that the women on the show seem to be staggering around under. Makeup is something that I never really notice, but this is the first time I've ever leaned forward in my seat and gone  Holy cow, how long does does it take to do that?  Oh yeah, then there's the premise of the billionaire kid who become a martial arts superhero in only 5 years, the IT girl who can  hack  FBI encryption in two keystrokes and the mindless dialog... Yes it's a  superhero  series, but to me it just feels horribly awkward and clunky. Somehow though, it's still watchable... ","4"
"Arrow",2013-09-17," Just saw the first episode and after high expectations am somewhat disappointed.Good things up front: Stephen Amnell is a pleasure to look at and his costume really is one of the cooler ones in the superhero world (no pointy ears, no tights, no cape to get stuck with in a revolving door). And there is no awkward animal-reference in his hero-name! However, the story and the character seem kind of familiar. Young Millionaire comes home after having suffered. At home, he keeps playing the high society idiot, while in his secret fighter identity he tries to save  his city  from the bad guys with the help of his butler - sorry, driver. Oh, and his wannabe-girlfriend is a lawyer for the poor and helpless. Sounds familiar? You might say: Why not copying a good idea? OK - but this was not a good copy. In a series, you normally have more time to evolve a character, than in a 90-mins movie. However, this was just clad together without any love or effort. They gave Batman much more time in his movie to show his motivation, his background, to make the character 3D. My feeling in ARROW was:  you all know the general idea anyways, so let's tick of the main points so that we can get to the action.  If you like that - It's your show.Some more irritations: His father, after having been a  bad guy , turns around in a life-threatening situation (where normal people think about themselves, even more so a bad guy) and asks his son to set everything right - not really convincing. In Batman at least, Wayne tries to keep up the ideals of his father, which he grew up with - much more convincing.ARROW pushes away his girlfriend, just when she seemed to mellow towards him. In Spiderman, they took a whole movie to motivate this act. Here - nothing (ah, you know, that's just what superheros do, so swallow it!) The bad guys here are the  Money Makers . OK, after the financial crisis, that was to be expected at some point. However - as opponents for a super-hero? I mean - to defeat simple bad guys (like the Cat, the Penguin, Dr. Octopus) with simple kick-ass action, that is OK. Nothing against simple solutions - but then create bad guys where that fits. The worlds economic and finance system is just too complicated for an  I kill them and then their're gone  solution. So the ARROW certainly satisfies the desire for vengeance, but not the desire for a good story.Promising, however: the hint at the end, that his mother is up to something against him. Whether this motivates me enough to watch the second episode, I'm not sure yet. ","5"
"Arrow",2013-09-13," I wonder if people on here have actually seen anything past the 10th episode, because this thing got off to a rocky start. It stumbled, fell, and almost died on its way to the ER, but somewhere, the acting started coming together. After being squelched and tweaked, most of the cast departed from the soap opera plague that infested it, early on.Arrow borrows a little from Nolan, but does it well. Reminiscent of Bruce Wayne, Alfred Pennyworth, and Luscious Fox, Oliver provides raw emotion to the quest, Diggles his moral center, and Felicity, in a Freudian id, ego, superego tug-of-war, provides a pragmatic middle ground. Like the Dark Knight series, the name of the hero is very loosely associated with the depicted character.  Green Arrow  is actually called  lame  in the single time it was mentioned. A huge departure from the Nolanesque is the character's willingness to kill those that stand in his way. He racks up quite a tally, and isn't really sorry about it.The origin story is interspersed within the actual real-time story line, which reflects on the character. Oliver's transformation happens quickly in places, and shows that he is tougher than he appears, but the naivety on the island isn't as convincing as his hardened demeanor after his island trial-by-fire. That makes me believe that the island cut scenes were shot before the rest of the season, making it impossible for the cast to form the close working relationships that would naturally happen, later.Villains are not superhuman, and their place is more of a conspiracy, rather than a target of revenge (Diggle's brother, aside). Oliver's quest isn't about revenge, it's about going down a list, and checking names off as these names get offed. Some episodic deviations occur, and should be overlooked, as the overall story arc is actually pretty good.Playing Oliver Queen, Stephen Amell is physically devoted to the roll. More than just a few of the stunts look like they were done by him, and nobody should doubt his dedication to the physical prowess of his character. For all of its weaknesses, Arrow takes enough from Nolan to make itself a solid base, and makes for a good TV adaptation. I give it an 8/10, but a rock solid 8/10, with room to move up.Watch it through to the middle of the season, you might be surprised. ","8"
"Arrow",2013-09-07," I was never keen on the poster and the Green Arrow wasn't high in my hero list but I must admit I was gripped by this show with it's premise and it built up nicely with characters and plot revolving around a few central stories. It was nice to fresh faces in the cast and not full of plastic actors. There definitely was a good mix of twists and turns in the plot and I really like the flash backs. Each episode holds on it's own as well as revolving around a central theme. This paves the way for other hero shows and look forward to series two. I would like to see more of a cross over with other DC characters to open up new shows as well as pave a way for the justice league. ","9"
"Arrow",2013-08-04," I'm not a Green Arrow fan. I only know of him through the Justice League animated series and he'll occasionally appear in graphic novels such as the Dark Knight Returns Part 2, which is why I took an interest in this show.To be honest, I really feel like this show has MUCH more potential. G.A. was originally designed after Batman (millionaire, father dies, etc), but the structure feels more like Smallville but with a lesser known character. Rather than play on the witty gadgets that Green Arrow might use, the directors chose to play on focus on family drama, ie G.A. is the overprotective brother, mother is with another man, his best friend sleeps with his girlfriend, etc. I also wish the show wouldn't make Detective Lance look like a complete moron. It would've been great if the makers of the show provided more perspective into the lives of other lesser characters such as John Diggle, Thea, Laurel, etc. G.A. feels like a 2 dimensional character, yes he killed in the beginning, but after that he simply wants to bring justice to the city and every episode seems to end in the same way. There was hardly any villain that was equal to G.A.. Comparatively, Batman can be seen in many different angles. For instance, Batman could be seen as a man who NEEDS to be the caped crusader and subconsciously creates his own nemeses.Lastly, the dialogue was overly cliché, which made a lot of the characters seem 2 dimensional.***SPOILER***I know I said lastly, but they freakin' killed Deadshot. No freakin' wayyyyyy!!! ","6"
"Arrow",2013-08-01," The main actor is as wooden as they come and looks ridiculous in every scene. After the opening few seconds i knew it was going to be awful, I saw a bad explosion effect and a man wearing a silly looking hood and an obviously fake beard. In fact, everyone looks ridiculous with bad make up and lighting. The writing is painfully dull, any attempts at humor are mind bogglingly unfunny. The main character is highly unlikable and it is difficult to find anything with which to identify. The director seems to have done nothing but point the camera in the right direction as there is no flair or artistry evident. How does this have a high review I just can't understand it. ","1"
"Arrow",2013-07-28," Arrow is a very entertaining series. You'll find your self biting your nails occasionally. The starting is a quite blunt but it gets sharper as the plot moves forward. They also did a good job ending each episode with an exciting sequence which makes sure you watch the next episode.The biggest flaw is that it lacks originality.It seems clear that the whole theme is based on Christopher Nolan's Batman Franchise. There are several parts in the show where you feel resemblances to the three batman movies. I also expected similarities from  Cast Away  which I am glad wasn't there.Apart from these two movies several scenes remind you of epic scenes from various movies. Looking at the bright side those scenes are worth another watch and the crew has done justice to the original scenes.I believe its worth a watch if you are looking for entertainment, but chances are that you have already heard the philosophy part in other superhero movies. ","6"
"Arrow",2013-07-28," Stephen Amell brings us a more serious Oliver Queen as opposed to the obvious comparison from Smallville (where Justin Hartley, while amazing, wasn't the leading actor and thus the character's story wasn't as much emphasized). While it doesn't completely stay true to the comics it still portrays the characters amazingly and the cast is superb. The show doesn't only bring DC Comics fans a lot of familiar characters, but also manages to incorporate the origin story in a wonderful mix. After one season I can say that it is one of the best comic-book series out there and I would recommend it to anyone who enjoys a more serious series around comic-book characters who kick ass and yet bring a lot of emotion to the table.The show doesn't have a lot of comedic relief which I usually appreciate in serious shows, but It's harder to review a work-in-progress and I look forward to seeing what they are planning to do next. The writers definitely know what they are doing. ","9"
"Arrow",2013-07-27," This show is so very unpredictable that even me (who is good at guessing what is going to happen next) can't see what's coming. This show is amazing and has too me on a long ride of superhero drama. Every episode ending is basically a cliff hanger that leaves you questioning either, every thing about the story or everything about the characters. The acting is amazing. Stephen Amel as our Emerald Archer is one of the best casting choices I've seen on T.V. The rest of the cast also work so well with each other and Katie Cassidy is brilliant as well. I praise this show so much because I think it is well done in every area. The action is brilliant and suspense filled which is good because it goes so well with the theme of the show. Arrow is such a young show and is going to grow and become even better (if that's possible) and I personally can't wait to see Summer Glau in the next season because season two is going to be spectacular. ","10"
"Arrow",2013-07-26," its just amazing. i love the action scenes. but they said its Action | Adventure | Crime but they forgot to add drama there's like 10 minutes of that. but still an awesome show you have to watch it.. but the comic is a bit different. i mean if you read this which is an analysis of his life, ( http://dc.wikia.com/wiki/Green_Arrow_(Oliver_Queen)) its kinda different... and it would be cooler if they get one or two characters of the justice league to help. batman would be awesome with him. batman's life and arrows are kinda similar, i mean there both billionaire vigilantes. like imagine if arrow was kidnapped in Gotham City and batman comes and helps him, and then tells him to join the justice league :D. ","10"
"Arrow",2013-07-20," Its been long since I dumped the Smallville as it became awful somewhere from season 7 or 8. It had an Oliver Queen too. Now, this guy from Arrow  as Oliver is aggressive and passionate about what he is doing. The story begins somewhat in a usual manner but then moving with nice pace of twists and revelations. It could be boring if you think too much about it, but for a regular viewer looking for just fresh  superhero without superpower  entertainment, you have a winner here. True, any other character except Oliver is not detailed, they are just out of the box, but the real character is not them, hence its understandable. Acting is a vital point here, Stephen Amell does a real fine job characterizing the Green Arrow. Paul Blackthorne is great as a cop. Other characters such as Colon Donnel, Susana Thompson are doing nice too. Its a nice superhero series, you will love it as I do too. I give it a 9/10 for the nice time pass. Cheers. ","9"
"Arrow",2013-07-16," If you can look past the horrid acting, the more than just lacking substance plot and the under developed characters - this series is for you. But then again, if you watch something based on the leads six-pack, somber mood and distant stares then you will love this poorly created series. Personally I prefer stories of substance, a tale with progress, characters and a protagonist that has more going for him/her than just a pretty face or/and chiseled abs. It is hard to believe that Arrow has survived critics and audiences and has made it to a renewal of a second season. It's sad to see quality writing i.e Smash be removed from channels and hogwash such as Arrow be allowed to fill the mind of the average intelligent human. ","2"
