"Show","Date","Review","Rating"
"Supergirl",2015-12-06," Arguments about any  feminist  agenda aside, my problem (and my family's) is that the show is very poorly written and produced.Action sequences are lame, relationships are absolutely pubescent, characterization is poor, and on and on.The effects in combat scenes are poorly done. Worse, the action is ridiculous. Case in point #1: two people using  laser vision  against each other. The strike in the middle as if they were quarterstaves, and when they move the rays are deflected upward to strike a beam. Light doesn't work like that; if two lasers (or flashlights!) are pointed at each other, the light passes through the opposing beam and strikes whatever it's aimed at. Case #2: Supergirl gets struck in the chest by another bean and is blasted backward like a shot, but ripping off a car door and holding it in front of herself completely stops the same beam. There are far too many other examples to list.Kara is what, in her late 20s? She acts like she has a 12-year-old's crush on one guy, giggling stupidly and looking awkwardly, while completely missing the signs of another potential paramour. She is completely cowed by her boss (ok, maybe I can let that one go), but should be far more self-assured considering the show's constant feminist leanings. She has lived 15 or more years on Earth already; she should be past that stage in her life.Supergirl doesn't ever let go in combat even when she's literally being killed. She KNOWS she has the same abilities as her cousin, but at one point he has to show up and simply stands before her attacker and ignores the same attack that is killing Kara. How many times must she suffer badly at a bad guy's hands before she thinks  Hey, I'm being killed, perhaps I should hit back hard?  And really... the whole glasses/no glasses  secret identity  is as stupid as it ever was. I mean, anyone who has ever seen her up close (like her boss, duh) in both guises can clearly see the little indent above her left eye, not to mention the smile, the face, etc. To quote a scene from Lois and Clark years ago, it's just  galactically stupid.  There are so many plot holes and failures in general that after 5 episodes, my family has chosen not to watch any more. It's a shame, because we REALLY wanted this show to be good, at least on the level of Flash. The Supergirl/Kara character has just as rich a story (in the comics) as Superman, but this show is failing her in a big way. ","3"
"Supergirl",2015-12-05," I am thrilled that I now have a weekly date with my nine year old daughters to see Supergirl. As a parent, it becomes hard to find TV shows where you can share some fun time with your children.The impact is wonderful, just as I did as a kid, they spend their recess playing Supergirl. Each of their friends is either a heroine, or villianess, and they cannot wait for the next week to pass so they can see the next episode.I have seen all of the Superman shows, starting with the old Black and Whites, through Lois & Clark, Smallville, the comics, and all the movies. This show is just as fun, and fresh, since Supergirl is not as perfect as those other shows. She gets beat up, hurt, cries, and comes back! Is it so bad to have a nice, strong, female role model? Keep on flying Supergirl! I hope we see you for a long time ","10"
"Supergirl",2015-12-04," I really wanted to like this show because I generally love/like the superhero genre. The cast stand-outs are pretty-much Melissa Benoist and Jeremy Jordan and on their shoulders and with better writing this show might have attained it's potential. Such a shame! Anyhoo, I find myself fast-forwarding through any of the scenes with Calista Flockhart, I think with good writing and direction she can do well, but her performance in this is so flat and idiosyncratic (In a NOT good way!) that it is just about unbearable for me. I can imagine very young viewers enjoying it greatly and perhaps if they changed the time- slot to early morning cartoon time it would sit more comfortably. You can have one or two actors with charm, but unless you bounce them around in interesting situations and with other interesting characters, it isn't enough to save a sinking show. I have wondered what it requires to be 'saved', perhaps the death of CF's character, increasing the relationship dynamics between the two charmers (Benoist and Jordan) also using the 'race against time' device a little more and with greater deftness - as she is indestructible so the drama must be milked out of the vulnerability of those around her. Perhaps it is they are trying to appeal to both an adult and an extremely young audience so they never put any real meat on the bones? A pretty tricky situation for this show I think... ALSO - whoever did the music should either be schooled hard or sacked! Sheesh! ADDITIONAL: Now the show has changed hands I have noticed some definite improvements so I will increase my star rating from 1 star ... also, every time they include Martian Manhunter the whole show lifts a few notches - the actor is just so darned likable as is the double-sided character he plays. Hooray for TV shows that eventually get their shizz together! (o: ","4"
"Supergirl",2015-12-03," Please keep in mind that this review is from someone that grew up with George Reeves as Superman when I reference my comparisons. Super girl is a  dramady  in the best sense of the word. Before the season started, I wondered how they were going to do a show without it being just a rehash of former Superman, Superboy, etc., shows. But by giving her ordinary human qualities the writers and producers have created a character that is much more 3 dimensional than any of the past shows and movies. She can be a klutz, she has a temper, she makes all kinds of mistakes in judgment, she hasn't yet learned how to handle all of her powers and much more. And the real kicker is her human stepsister worker for the secret agency that manages and controls her and other aliens, good as well as bad. The other fun character is the head of the company  Kara  works for, as played by Calista Flockhart. Reminds me a lot of Perry White, except female, thin, and younger. Fascinating how this show and Gotham can be so different in form and style and yet both be so entertaining ","8"
"Supergirl",2015-12-03," I've suffered through the first 5 or so episodes of this series mostly because i was board.It seems like the plot was written for a 10 year old girl, not well thought out. In a nut shell - constant feminist theme, overcome adversity, blahh blahh blahh, good guys always win if they try really really hard, no real twists or suspense, predictable story lines, and the characters don't match the tried and true superman storyline.Im all for mixing up an old story but the writers killed off several of the traditional suspenseful parts of the superman story in the first episode. Aspects of the story that really helped make it what it was.Super girl is cute at least but all of the writers attempts to add romance into the story line fail terribly.If they want this show to air on more than the Disney channel i would seriously hope they kill off some main charters, add some heart break, and start over to try to save what little plot they have managed to build.Please make the fight scenes at least a little more realistic...i mean i understand its  super  powers and all but a little realism in how people in these situations would actually fight would be nice. I mean they can have their powers and all but it would be nice if they didn't fight like a 3rd grade slug fest.Also writers...who never seem to understand this...IF YOUR GOING TO TRY TO USE REAL SCIENTIFIC TERMS AND UNITS HIRE SOMEONE TO HELP THAT ACTUALLY UNDERSTANDS WHAT THEIR TALKING ABOUT. Seriously a multi- million television project and they cant fact check their script. The watered down physics class at your fine arts college doesn't mean your an expert. Either get it right or don't try at all, or at the very least f****** google it before you embarrass yourselves on nation television...Wikipedia is free for gods sake. Im an engineer so i may be a little wiser on those things than most but nothing is more annoying than people trying to sound smart and failing. Spend .0001% of your budget and hire someone to help you fix your terrible science fiction. ","3"
"Supergirl",2015-12-01," am not gonna write essays, i'll just keep it simple fight scenes- terrible, she's not threatening at all and the fights are badly co-ordinated, don't get me started on the CGIfeminism- i get that this show represents feminism, but there's a subtle way to do it, the lines  why is it always men with road rage  and  because/especially if you're a girl  and many others are just forced and un-called for. Jessica Jones knows how to do their feminist agenda stuff without making it cringe-worthy-this is coming from a DC fan-boycostume- i actually don't mind itcast- am sorry but her boss, the blonde lady is probably the shittiest character ever put on TV ","3"
"Supergirl",2015-11-30," Plot and action was decent, but Melissa Benoist is not nearly blonde enough to be playing supergirl. I'm glad it was picked up for a full season. Hopefully that gives them enough time to gradually dye her hair more blonde to fit the character.And I have no idea why the director had Chyler Leigh cut her hair short for the role. Pretty sure this is also an inaccurate depiction of the character. I get that the director wants to put his own spin on things, but do that in the actual story line (which by the way, obviously needs more attention paid to) and not the character details. Swaying away from original character designs does nothing for the comic fans.Honestly, I just googled Alex Danvers dc comics and the first pictures from Pinterest of all places had better character designs.Also, after seeing the success for Arrow and Flash, the cg animations were pretty disappointing for this show. ","5"
"Supergirl",2015-11-30," I really wanted this show to succeed or at least I wished that it entertains people that it could go on for few seasons.But no way it's going to see season 2 or 3.- Acting is extremely awful. Especially supergirl. - Script is much worse than my expectations. OK I did not ask for a masterpiece but this is an insult to audience. They exploit the archenemy in episode 1 and she beats her in episode 2 and then struggles with her boss, her boss's kid, her mom, her love for the rest of the show. So how does it differ from a Brazilian soap opera?There is no fun no entertainment no action no excitement no of anything. Unfortunately one of the worst super heroine show of all time.Writers must be replaced to save the show. Hope it's not too late. ","3"
"Supergirl",2015-11-28," I don't get the hate. It has it's flaws, ie. The first few episodes were a tad rushed, but it's getting great. Hell, even Game of Thrones was awful until the third or fourth episode, then that became one of the greatest shows ever. I'm not saying this is an award winner, but it does its job now, and is entertaining stuff.The acting is on par with Arrow, probably better, and the story lines and look have a similar tone to Flash. It's not a smart show, no complicated plot that requires a whole season to understand, i admit. It is a monster of the week show, and it's refreshing to see that. It also has lots of explosions, and action in every episode. And the Kara issues, even though i'm a guy, i'm relating to. The drama in the background is done very well. Maybe you have to relate to it to appreciate it? I don't know. But some of the characters are going through similar situations to what i'm going through in life at the moment, and reactions are how i'd react. So i can't knock the acting or the dialogue. It's spot on for me. Winn is pretty much me in real life too, so hats off to getting that bang on.As for the look. I get the feeling they were gunning for a similar tone and feel as The New Adventures of Superman, in terms of dialogue, focus, and target market. I think they nailed that. It's obviously for the whole family; not dark, no steamy scenes. The CG is fine. not as bad as many make out on here. It's better than the CG in Dr Who, and in Primeval, and The Matrix for that matter. Enough of that though. It is simple show, comical at times, and has its flaws. But it is entertaining. I think people look past that in TV and film sometimes; look too deep. You don't need to. ","9"
"Supergirl",2015-11-26," I write this knowing full well this show was not made for someone my age, and I've only seen the first episode. I won't go into the plot, or lack thereof, I just want to ask why I'm reminded of William Shatner when I watch the fightscenes. Come on, she's supposed to be a superhero, but her fists travel at the speed of smell and she moves like her joints don't work properly. At least some of the budget of a superhero show should be spent on fightchoreography. The cgi also needs a drastic upgrade, because what was shown in this episode was not good. I know that this might have been fixed in later episodes, but I doubt it. ","3"
"Supergirl",2015-11-25," Not sure what demographic they were shooting for, but they missed it. I wouldn't let me little girl watch this in a million years, and I'm not sure who would ever. Not sure why Hollywood is going down this road. Oh wait, yeah I do. I love how they think no one knows what they're doing. You can brainwash people all you want, but everyone knows better. There's only one thing I've heard everyone except those in your industry say and that's how much garbage you put in front of us. We know you hate us and that you're trying to wipe us off the face of the planet, but you're only hurting yourselves Hollywood. Keep this up and in a couple decades there won't be anyone to disappoint. There also won't be anyone to sell tickets to because we'll be living in a third world country. ","1"
"Supergirl",2015-11-24," The pilot was a bit too predictable, cliché, quite busy and overdone. After that you are in for a pretty cool ride. Keeping the wit and action balanced as in the old classic cartoons, this series reminds me of the days where TV was entertaining yet innocent. For me I have learned that it takes three episodes to even consider giving a series my opinion. Its like meeting new people, some people give good first impressions then later on, their true colors come out. Others seem conceited but end up being the best of people. TV shows are a lot like personalities since people wrote the shows, after all. And as a viewer i feel it coming through the screen touching my heart. This show is that dorky little girl with glasses who seems kind of silly, but ends up being gorgeous, witty and smart. I also like the whole innocence of it, like the old classic superman TV show. ","9"
"Supergirl",2015-11-16," Don't know a thing about Supergirl comics, I just love good sci-fi and was excited to see this new series.Watched the first episode and couldn't believe how bad it was. The acting, the script writing, the hopelessly pathetic  super hero , the instant caving into bad press, the instant bad press generated by a jaded? public (how could the public be that quick to judge?)That it's based roughly on the Superman story of her being affiliated with a news agency in a lowly position is OK, not super original, but as long as the actors and script writing makes it interesting, so what. But for her to be so groveling and with such stupid / ridiculous scenes coming from the scriptwriters is not acceptable. I don't think its a spoiler to say she's up against criminals from her home world from the very first episode. So not only is there little to no development as she's growing up and into her powers (she doesn't even use them for cripes sake in her formative years), she has zero self-confidence and once she does bust loose with her powers to help others, she's pitted against the strongest, most evil adversaries imaginable, and a public that is passé on super heroes and are super critical of her from day one.My favorite superhero stories give you background as to who they are as a person and what they're willing to do to seek their revenge / help others / have a moral conscience / etc. Here, nothing. If you identify with someone who isn't self confident but ultimately has value, then you might think I'm being too hard, and as a guy you might think I can't relate to what a young girl would be going through. But I'm sorry, there's little to no character development here, its like we're plunged right into the 3d season of a B movie quality TV series from the 80s or something. I watch mostly movies and TV series of the last 15-20 years because of how amazingly good acting, scriptwriting, production values have gotten. Not so with this bomb, I wanted to give it a second chance, and did watch the 2d episode only to find myself going over and over again,  Wow, this has got to be the worst scriptwriting I've seen In forever , and while the acting is not great, I mostly blame the scriptwriters and producers for such a lame concept of how to draw an audience into a story of a female equivalent of Superman. Don't waste your time, judging by the D- to F quality of the story so far, I'm sure it'll continue to disappoint. ","1"
"Supergirl",2015-11-16," to be honest: i didn't expect much. but sometimes a lame comic story can transform into something special (see  men in black ) ... unfortunately not this time.  supergirl  is - no offense! - one of my most boring and dull TV-series experiences i remember so far. the visual effects are behind their time (even  the flash  has better CGI and surface mapping), the story (girl should help little brother - has a space-accident - arrives with delay - in the meantime brother has become SUPER-man - SUPER-man helps lost little sister - little sister imitates (now) big brother including being a no-name reporter - little sister is fumbling with her responsibility and does many things wrong etc.) - is of an extremely offending sexist undertone (despite - or maybe just because of - all the wannabe-feminist-gags) and maybe worst of all: cosmetic-surgery- and botox-victim calista flockhart, posing (not acting) as the female pendant to perry white (and so an imitation of a man, too, of course). but maybe i am wrong. maybe i should wait until episode S06E03 or so to see the transformation into a pro-female, pro-women's rights, counter patriarch-ism-TV-show with interesting characters and excellent actors. but, honestly, i doubt it's worth trying. it hurts too much to see over 100 years of female emancipation progress flushed down the toilet of a conservative studio back-room.i seriously pity the basically sympathetic but poor girl who acts as the miniskirt-super-girlie in this embarrassing TV-show, because it will be very hard for her to get some decent job after this role. ","1"
"Supergirl",2015-11-15," It's refreshing and quite enjoyable. Definitely a positive family program.Those who disagree, your volume's muted.Those of you that don't like it, use your remote and change the channel.Those of you perverts that want sex, drugs and psychodrama, subscribe to Showtime, HBO or the like.Those of you Big Bang Theory wanna be, read your comics and stay away from television because you're stuck in a fantasy world with limited imagination.I applaud CBS, new faces, familiar faces and the powerful concept behind SUPERGIRL.I'm tuned in and enjoying every moment. ","8"
"Supergirl",2015-11-13," I don't know, maybe it's me. There are a lot of people who gave this show good reviews. Did I miss something? What are they seeing that I'm not? There are just too many inconsistencies here. An example--episode 3 has this guy Reactron (???) who is human and whose ''power'' is some kind of nuclear blast generated from a suit. Now if I understand correctly, this guy fought Superman to a standstill and got away? Sorry, I don't buy it and any Super family fan won't either. We're talking about a man who fought a bunch of Kryptonians with the same powers as he has and won and we're being told that Reactron all but beat Superman and got away? What are the writers smoking??? Now,if you're looking for more strange behaviour look again at episode 3. Reactron is roasting Supergirl, Superman shows up, does nothing about Reactron but brings Kara home and leaves! Oh, sure, the writers try to justify this with an erupting volcano somewhere but it just sounds hollow and false. If I saw my cousin being beat up I'd surely want to defend her, wouldn't you? Only logical, but here Superman just leaves and does nothing about it. There are many other things that grate on my nerves with this program but the worst one is the Cat Grant character. Somebody do something about her please, i can't stand her anymore!!!!! Well, that's it for me. I'll give it one more try. If I don't see any improvement by next episode I'm outta here. There's better writing and acting in the Saturday morning cartoons. I had such hopes for this show. I really wanted it to work. Sob.... ","1"
"Supergirl",2015-11-13," I loved it, because a 'female' super person is a fresh idea and I was glued to TV all hour, pay no attention to bad/silly review, I smell jealousy ;)\To those bashing this for having a 'bad' script , did you expect DEEP plots, along the lines of the previous incarnation of super man, well if so that's unfair to this attempt with a different protagonist.I looked at this with a objective mind, not one that ridicules 'new' things or has excessive requirements just because its a been there done that series.If I feel entertained, enjoyed the effects and didn't yawn on the acting or characters/plot , then I'm good.I thought the characters were believable, villains as villainous as usual and I'm sure this will be as good or better than anything put forward so far.Highly recommended. ","10"
"Supergirl",2015-11-13," My Grandfather smoked his whole life. I was about 10 years old when my mother said to him, 'If you ever want to see your grandchildren graduate, you have to stop immediately.'. Tears welled up in his eyes when he realized what exactly was at stake. He gave it up immediately. Three years later he died of lung cancer. It was really sad and destroyed me. My mother said to me- 'Don't ever smoke. Please don't put your family through what your Grandfather put us through.  I agreed. At 28, I have never touched a cigarette. I must say, I feel a very slight sense of regret for never having done it, because this show gave me cancer anyway. ","1"
"Supergirl",2015-11-12," well i have been watching this show for the past few weeks and i gotta admit supergirl herself'Cara kent ' is an amasing heroine shes incretibly sweet gorgeous and tough as nails shes just too cute for words i love her little squint with her eyes its adorible the shows humor plays an awesome part of the show as well 'unlike Gotham another great superhero show 'its got a lighter town and can be very funny its a winner all the way i say watch it its also a good choice for most family's its tough but not too over tough shes a good role model for geeks 'girl or guys ' the true message is that if u believe hard enough u can do anything u set your mind too my 12 year old sister also loved this show its a good choice for young girls i say watch it 10 out of 10 rating ","10"
"Supergirl",2015-11-12," The show is so bad even IMDb's description belittles it.  The adventures of Superman's cousin in her own superhero career.  Why not something like,  The girl from Krypton is ready for action, as she ventures forth discovering her purpose while facing adversaries  . With all the changes to the story origin and characters I was expecting something better than and 1960's version of Superman. The dialogues are cheesy. The thought processes of Supergirl, who should be as smart as Superman, if not smarter as she actually had some Kryptonian education is unbelievable poor. Superman would take a beating and then bounce back but at least his efforts where heartfelt. The lackluster approach of this heroine leaves much to be desired. Simply put, how can she be living on earth for all this time and not be the number one fan of her 'cousin', the sole surviving member of her planet (to her knowledge). the story is trying to incorporate real world events but excludes the technology. If superman were real, there would be youtube videos and tweets and all manner of digital information that she could use as a database for reference. She should know his villains and how they were defeated. The story could have been written in a much better way. The reluctance for her to take up the mantle of Supergirl should have ended in a more traumatic way. The villains also need to be smarter and better coordinated. I don't know who to blame more, director, actors, writers, screenplay, cgi. This show needs a complete overhaul. ","3"
"Supergirl",2015-11-12," I love Melissa Benoist. Too bad the storyline of Supergirl is derivative (Agents of S.H.I.E.L.D. anyone?) and boring (any chick-flick you ever saw). The writing is weak -- the characters are cardboard stereotypes (especially Calista Flockhart's) and the dialogue is banal. Why is Jimmy (er, James) Olsen even in this show? And David Harewood is basically reprising his role from Homeland. I would rather see truth, justice, and the American way at the center of this show (enough with alien invaders already) and a lot less romantic claptrap -- Lois and Clark pushed that envelope as far as it can reasonably go. I watch to see the girl. I wonder how long that will be enough. ","6"
