"Show","Date","Review","Rating"
"Supergirl",2017-11-10," I'm a little surprised this show does not have a higher rating. I've been watching this show before it moved to the cw and our family tries to never miss it. Although this season they changed time slots and that's NOT working for me. Anyway, Melissa Benoit is adorable as her dorky alter ego and kick ass in her hero form.I wish Callista Flockhart would have stuck around longer but at least we had her for a little while. The actress who plays Lena Luthor is great!!! I also like supergirls sister Alex who works for the government and is initially her only confidante.I'm glad the cw has added this show to its lineup, its a much better fit. I love the crossover shows with the Flash which are great fun and will hopefully continue. If you are on the fence, take the leap and watch! Great superhero fun! ","8"
"Supergirl",2017-11-07," I am done with the show #Supergirl. We are now at the beginning of the third season and Supergirl has taken the Road of  Bones , after the 5th season, getting more and more stupid with each episode. I am fed up with the SJW crap, all the feminist bullshit for millennials and other propaganda they keep shoving up the viewer's throat. Relationships are USELESS, badly written, with no impact on the characters just to please some social / minority agenda (Mon-El is antipathic, Maggie serves no purpose, but for a LGBTXYZ quota on the show). Dialogues are badly written, nearly all males depicted act as if they are castrated. Just because the audience also includes kids, does not mean that actors should talk like retarded teletubbies, just look at Joss Whedon's Buffy and Angel. Supergirl seems to think that people keep attacking her because of her lady parts. Superpowers are rarely / badly used (WTF!): Supergirl getting her butt kicked by humans with some gadget<U+0085> where is the superspeed, where are the superreflexes? Writers do not seem to have read any Superhero comics, and do not understand their appeal. Every time Clark Kent / Superman is mentioned, he is put into a bad light (?!!) However, if you forget the subtext that  Women are better than men , then they won't forget reminding you at every turn. Actors are good, completely out of sync with the real comics, writers suck as Black Holes suck matter. I was already watching the last 10 or so episodes with the mouse more pressed on fast forward than on play. Everything mentioned here is the tip of the iceberg, I won't even talk about the rest. Mellissa Benoist being really cute is not enough a reason to keep watching the show. Were there good episodes? There were some really GREAT ones, especially the crossovers with Flash and the Arrowverse, and these are the only ones I will keep watching.Could they get any worse? When a Villain shouts  SUPERGIRL! , Supergirl could ask  DID YOU JUST ASSUME MY GENDER?  ","1"
"Supergirl",2017-11-05," I really like this show and believe that it has great potential to go the distance at least to 10 seasons; However, the current story-line for the past two seasons has been to promote LGBT awareness and acceptance to create a genre that bridges all generations on the subject matter. The problem here is that it's being dished out in spades without the consideration of balance and at times taking away focus from the actual story-line of Supergirl. Imagine if every show of Supergirl included a priest citing passages from the Bible and building a story-line that suggests you should go to church every Sunday! Would you accept that has okay and normal? So yes being Gay is your right so is going to church on Sunday, therefore, Please! Could the producers and writers find a balance that exercises a story-line that doesn't seem dogmatic or overbearing also at the cost of ratings, but rather one that sticks to the excitement we all experienced from season one that of Supergirl!! ","5"
"Supergirl",2017-11-04," *** This review may contain minor spoilers ***Hey there, I usually don't write reviews but for this show I just had to do it.Now that being said lets get right into it...First off...the show just looks cheap and that is not due to some low budget issues, no it is due to the poor script acting and the awkward changes to some of the key characters from the comics...now the positive thing is that they kept the names right, but that is about it. From there it is just getting from bad to worse like the very distinctive Feminist propaganda and agenda, the racist move to replace the appearance of a fan's beloved teen geeky character like J.Olsen with an old black man... Just awful...not to mention all the explicit gayness side of the show. Not that I really care much if someone decides to go against the nature and unlike any other representative of the roughly ~8.7 Million species that are out there that happens to fancy an individual of the same sex as his own, but I'd rather avoid seeing it on TV...and even if this is 21st century 2017 I still can't understand how people could say that being gay is normal...it is more acceptable and not so shocking as it was in the past but it most certainly is not normal. I can't sit in front of the TV with my little daughter and let her watch that trash, as I would definitely am going to be asked questions that I am not really sure how to answer...It is getting out of control with these gay relationships invading my favorite TV shows...and before you say  Oh, look another homophobic guy ...no that is not what I mean...do what you like and with whoever you like, but something that is not natural should not be tolerated in the sense that if it exists it is normal and must be displayed like that...also before you use words like discrimination... well I don't find it discriminating if you don't like to accept a gay relationship or call it normal simply because it isn't it is against the nature thus unnatural...it would be discrimination if I say  I don't want to see people with different skin color than white in films  because that is something natural and normal...So that is it to summarize the show: It is about a girl, you will not forget that; women are as strong as men, if not stronger; lets give this show a modern look change beloved comic characters' personality, appearance, skin color; lets throw some heavy gay drama aspect as wellIt is really hard to enjoy the show so you would be definitely better off and find something else that is worth watching! ","1"
"Supergirl",2017-11-02," It was an okay TV show, but season 3 is such vile ideological, brainless propaganda it deserves to be canceled yesterday.I love superheroes and it saddens me that Supergirl is hijacked by the leftist ideologues. Kids need someone to look up to teach them good values and proper behavior like courage, truth and selflessness. They don't need to brainwashed into group think and identity politics, scared to even question that and think that silencing anyone they disagree with for whatever reason is acceptable in a democracy.I wish producers and writers publicly apologize. Fat chance of that happening, but you can not watch the show. Which is what I'd recommend and what I'm doing. Vote with your wallet and your attention. You do have a voice and a choice. ","5"
"Supergirl",2017-11-02," Disregard the hateful sexist racist homophobic republican reviews !! It seems these blowhards are just blowing hot air because of their hate and intolerance. This is the greatest show ever !! Great writing and characterizations !! The show perfectly balances action humor romance and pathos. ","10"
"Supergirl",2017-10-31," The writing for this show just continues to go downhill into Season 3. It's like the writers don't even know what they've written already. For example having Maggie's father commenting about how they want to build a wall. Just stop with the constant Donald Trump jabs already. I'm as liberal and progressive as they come, but even I find the constant political garbs off putting and unnecessary. It's sort of like in the debacle that was Season 2 where they had Kara tell Mon El that maybe being Supergirl and being with him was enough when in Season 1 she told J'Onn that being Kara Danvers and having her job at CatCo was just as important to her as her Supergirl duties when he offered her to work full time at the DEO. Do these writers have existing story line amnesia or something?What I'm really irritated with is the show's handling of Sanvers. These writers and show runners knew from the start how invested the LGBTQ community would get in Sanvers, especially after giving Alex such an honest coming out story. But unfortunately, they completely botched Sanvers with a rushed, barely fleshed out story line with minimal screen time...then gave them an unrealistic engagement at the end of Season 2. Now in Season 3 we have to believe that they are going to break up over Alex suddenly deciding becoming a mother is more important that being with Maggie? Really? It's OOC writing and and insult to the healthy LGBTQ relationship they were trying to portray to us. Look, I understand the show shouldn't be relationship drama heavy, and I agree. But these writers are the ones who keep insisting it be shoved in everywhere...and they can't even write a decent relationship to save their lives!I'm officially ditching Supergirl. I'm not here to watch them tear apart one of the few positive LGBTQ relationships that are out there right now. And I'm definitely not here to watch Kara be all moody after Mon El's exit only to have the childish dude bro return in a few episodes anyway. It's gross. Supergirl is gross...a gross train-wreck. ","1"
"Supergirl",2017-10-30," Ugh...where to begin? I liked Season 1 of Supergirl. Given its cheesy moments at times, Kara was an empowering character as she was coming into her own as a superhero. And Alex..Alex was actually my favorite female character. What was great about Season 1, for me, was that there were so many amazing, strong female characters, which is rare for television these days. Then Season 2 came around. I don't even want to get into how awful that season was with Kara taking a back seat to Mon El's story while having to watch her eventually hook up with him and become a side character in her own show. Plenty of other reviews have voiced their disdain for that disrespectful frat boy better than I ever could. I did love the addition of Lena Luthor and Alex's coming out story line. Fast forward to what we've endured so far in Season 3...Mon El is still somehow mentioned in every episode even though he's gone. Tech genius and all around bad ass Lena Luthor has given up LCorp so she can run CatCo...a company she knows nothing about and let's be honest...is a step down from being a female CEO at a tech company...an industry consisting mostly of men. Maggie is still only  Alex's girlfriend  and now Alex is suddenly obsessed with having children, (And has been grossly OOC this season) which is going to be the demise of Sanvers...one of the few healthy, positive w/w relationships on screen right now. Not to mention the writers can't even remember their own story lines and are making it up as they go along so they can get in as many jabs at Trump as they possibly can. (They're building a wall?) Really, because last time I checked, in the Supergirl world, Trump wasn't president. The only thing worth sticking around for at this point is the Sam/Reign story line. But I don't think it's worth enduring the rest of the dumpster fire writing that is continuing to plague this show. Sorry to say, I'm done with Supergirl. Which is sad, because I love the SG comics. And I was hoping we'd finally get great representation in a female superhero. Well, I was wrong. Guess I'm going to have to look elsewhere. ","1"
"Supergirl",2017-10-30," I think Supergirl needs to change the style up if they want to continue: make Supergirl more of a badass and more confident, and less emphasis on the romance stuff; that is how a superhero should be. Instead of just propagating only feminism content, it should be able to inspire EVERY young person, that they can be super themselves. I won't say much about the lesbian content, but it shouldn't be the main point of the show. I like how Supergirl sometimes partners up with Superman and other superheroes as partners in crime, keep those going. ","5"
"Supergirl",2017-10-30," I started out really liking this show but am really tired of the lesbian love story. I do not want to see it and do not think it is good to be forcing this agenda on children or anyone else for that matter. I will probably quit watching because of this and I'm sad that so many shows are doing this same thing. ","3"
"Supergirl",2017-10-30," I was never impressed by this show from day one. The acting was forced and never seemed to show that anyone was doing anything except acting. The story line was not half bad however and there have been so many new shows over the last several years where the acting was  forced  and improved immensely that I decided to see what happened. Season one was OK. In season two I started to say  Uh oh  and in season three this show has gone full-on politically correct leaning heavily left so that the last episode I watched LITERALLY had a screaming rant about a country that wants to kill immigrants just because they aren't here legally. In that episode alone I was subjected to over half the show being a demonstration on the left's agenda with only part of the show being about superheroes. I'm out. This show has become a progressive medium to push their agenda and it is not even done very well. That's not why I watch TV. ","1"
"Supergirl",2017-10-29," Season 1 was a good start, although it tried a little too hard in some areas (like trying to appeal to teenage/twenty-something girls) - which is not to be confused with the feminist message/theme. But overall the main characters were steady, believable, and the action/plot lines were interesting and fun. Season 2 faltered - a lot. It got way too racy, on both sides of the gender coin; it suffered the charismatic loss of Calista Flockhart and I really wasn't sure it would recover. The plot(s) were less interesting, less adventurous, the inconsistencies and forced points became too numerous or too jarring to ignore or overlook. And watching it with my kids became kind of awkward.But season 3 has been awesome so far. The writing, acting and chemistry of the cast is really coming together, the stories are more interesting, true to character (and life, despite the superhero genre, which is the point). Episode 3 (Far from the Tree) may be the best episode of all 3 seasons, but definitely top 5. Characters that I was really getting annoyed with (for writing reasons, not actor's performances) really come alive (like Maggie - her presence has driven me nuts but she won me over last week!).I hope whatever is going on early this season sustains throughout. This show really can be one of the best on TV when it stops meandering and trying to be too many things at once. ","8"
"Supergirl",2017-10-27," Great premise -   All girls can be Supergirls !  I think the potential to role model here is terrific. But - what god awful plots and execution. Soooooo trite it's hard to believe that this has made it beyond the first season. But - as we are now living in an  alternative  world - all seems possible. Sad. ","1"
"Supergirl",2017-10-27," So I started watching Supergirl with high hopes it would be better than Smallville, and it was a delight, at first. They stayed true to the comic book origin story, they dressed her in a costume that was faithful to the comic books, best of all, she could fly.Then slowly but surely the lefties in Hollywood started their not so subtle propagandizing.First we had the evil Martians, who just happened to be white, embarking on genocide of the green martians (martians of color, hint, hint, wink, wink).Next, we had the Supremacist group that wanted to eradicate all aliens. Interestingly, every single member of that organization just happened to be white.Then, we had the evil government attempting to control the illegal space aliens, but the point was clear, they were alluding to illegal aliens in the US.Finally, we have to have at least one gay or lesbian. It happens to be Alex. The problem is that slowly and surely the program is becoming more and more about Alex and her lesbian love life with at least three or more lesbian scenes or references per episode.The show has become less and less about the exploits of Supergirl and more about left wing propaganda. If you are looking for entertainment, this is no the show for you, it has more left wing propaganda than CNN or MSNBC.I would recommend that young children not be allowed to watch this show. ","1"
"Supergirl",2017-10-24," If you're looking for a lesbian show that has superheroes in it, this show is for you. If you're looking for a superhero show, well then notsamuch.Do yourself a favor and stick with Marvel if you want real superhero shows that don't get TOO political. If you must watch DC, Flash is by far the best if you just want to be entertained.Supergirl - season 1 showed so much potential, but once it moved to the CW, it went straight down the tubes. Too bad too, as Melissa Benoist really is a very likable Supergirl and really plays the role wonderfully. ","1"
"Supergirl",2017-10-24," Supergirl is sort of what The Flash was the first season. Its dumb, have tons of plot holes, supergirls powers changes all the time and some of the characters leave much to be desired. BUT it is also goofy, fun, decently entertaining and superhero-y, and in difference to the horrible Flash TV- show Supergirl stays that way. In other words Supergirl is not very good, but its still watchable and entertaining all the way up to season 3. With that said however the show is also promoting tons of liberal/socialist ideas and doing so too much in your face and even make gay-ness a major plot point for many episodes. That is annoying since it feels pushed in there and exists just for political point of it. I do not mind gay characters, they can be great and show versatility and diversity. Look at Joey in Agents of Shield, they just mention that he is gay in passing and make a couple of impasses about it, but it is never in the center and is never a big deal, that is just who he is, as it should be. In Supergirl being gay is a such a big thing that it overshadows everything else and that destroys the show. Some episodes feel right and I feel like  now , now this show is good. But in the very next episodes it crashes again. As an example of this I can mention episode 5 of the 3rd season, which is a good episode, but all the teen-drama-lesbo-ludicrous crap drops the episode from a solid 8 down to a 3 or 4. I will stop watching this show now, someone let me know when its about supergirl. I give the show a 4, which is much better then Gotham and The Flash ( 1's ) and slightly below Arrow which was great the first two seasons. Supergirl can be really good at times and if they drop that too-much-in-your-face-propaganda and develop the characters a bit further it would be a very good time spent. I can recommend the show, but mostly for young people and for those leaving their brain on standby. DC need to do something though, all of their shows are failing while AoS is the best thing on TV at the moment so I would suggest bringing in new talent and shake things up a bit. Kill of a few characters, mix the earths into one single place and bring in better writers and directors. There are good shows and good premises within the DC TV universe, but its not coming out and sadly it is getting worse... ","4"
"Supergirl",2017-10-23," I started watching this show last year and I found it not catching at all. But this year, after seeing some scenes from the second season, I started re watching it and found it captivating. Yes, the first season is not something special but the second season is completely different. Plus Kara's romance was completely amazing and Mon El is definitely a funny and interesting character of the show.I loved how he is getting used to being a human and their habits. I have completely enjoyed it and I can hardly wait to see season 3. Definitely worth to watch! ","9"
"Supergirl",2017-10-18," I have two issues with Supergirl.1/ Too much self doubt (it's a theme in The Flash and Arrow as well). So glad the characters in Legends are mentally stable. I have enough issues of my own without listening to the characters complain for 42 minutes.2/ Also this year the terrible music at the first and end. I'm finding a lot of shows like that now a days and it's a turn off. ","5"
"Supergirl",2017-10-17," Supergirl is my favorite show so far. I've watched it so many times. I started to watch it sometime in August. Season 3 started off with a good start. There where some sad moments like; in season 2 Kara had to make a difficult decision that caused Mon-El to leave earth. I really did love the crossover episodes. I can't wait until season 3's crossover begins. Maybe session 3 will tell us what happened to Lillian Luthor. Lillian Luthor helped save the world and then she disappeared. I hope Clark Kent will be in season 3. ","10"
"Supergirl",2017-10-17," This will mostly be a condemnation of the writing, but first lets talk about the actors. The actors are doing the best they can with the drivel given them by the writers. Still, the best description for the actors that I could summon if the writing was good, would be  adequate . No Oscar winners here. Now, on to the writing. The show has degenerated into a lesbian soap opera, complete with sexual scenes completely inappropriate for the time slot. On top of that, we are beat over the head with an unending stream of Liberal hogwash, and poorly written Liberal Hogwash at that. Even the show supporters are forced to utter excuses like:  give the show a chance, it'll find it's way . Sadly, the show WON'T find it's way. CBS (and now CW) are determined to shove this Liberal propaganda down our throats and AREN'T going to change it, no matter what. The shows offensiveness is actually BY DESIGN, but created by people completely unable to recognize or acknowledge the mess they've created. If you've seen the  male-lead  superhero shows, you see that their writers build up their characters, both male and female. In Supergirl, only women are built up, men are depicted as evil, lowlife rats. the Supergirl writers only see the show as a place where you have to tear others down (the men) in order to built women up. What sad lives those people must lead (I mean those who live around the writers). ","1"
"Supergirl",2017-10-14," This could have been a great series. ** spoilers **But of course, Hollywood, being run by liberal dupes seeking to brainwash the world into their morality - or rather the lack thereof - and their political agenda of promoting LBGTQ, AGW, NWO, and all the rest of the now ubiquitous tripe being poured into your head by virtually every lamestream media dump out there, just is so freaking obvious it's sickening. The original red-haired, naive and freckle-faced Jimmy Olsen is now an underwear model style black guy with strong self-confidence. Sexism is rampant.Supergirl's human sister is moving towards lesbianism. The glaringly obvious propaganda and brainwashing tactics present are so pathetically obvious that a smart child could see through it. All the mega-corporation heads are women, oh except one guy but then he's a macho, self-centered jerk. The new hyper-feminist trash sexism that's flooding the poor world every day now is present in abundance. This is liberalism propaganda more than simple TV entertainment.The liberal post-humanist agenda is everywhere in this piece of politically correct marketing. Liberalism is a mental illness, but Hollywood producers are apparently too ill to notice how toxic they really are.I gave it a 4/10, for decent FX, some good action, some original story lines that aren't too far from the original comic series and some cool sci-fi technology.But let's face it. When Superman and the rest were invented many decades ago, 99% of the world rejected the LBGT lifestyle as perverse, and of course, they were right. Save yourself and your kids from the indoctrination. Watch something else with normalcy, decent morals and no shoving the twisted liberal mindset in your face - if you can still find any such thing on TV. ","4"
"Supergirl",2017-10-14," Season 1 was quite good and held well to the superhero genre. Season 2 started well but drifted deeply into interpersonal drama. Season 3 started the way season 2 ended, with less emphasis on the superhero and deeply into character emotions/relationships and social issues. These are important discussions, to be sure, but I watch superhero shows to see action and fun, not for deep emotion or for a critical societal exposé.Frankly I don't care who's straight, gay, engaged, in love, depressed, happy or psychotic unless it directly relates to the villain:heroine story line. Supergirl has, seemingly, fallen to influences (pressures?) far from the original comic book universe. It has become a soap opera. ","4"
