"Show","Date","Review","Rating"
"Supergirl",2017-02-03," I felt the need to write this review to counteract some of the sexist crap that has been posted previously. This show, yes, can be a bit cheesy. But what show based on a comic isn't? What I find special about this series is it's willingness to show us that heroes are born female as well. But let me explain- this is in no way SAYING that men can't be good heroes and women are better than men. No, it's trying to show us the subtlety of the struggle a lot of women face when trying to make a name for themselves, and the lack of strong female role models we have growing up. Supergirl has always lived in her cousin Superman's shadow, finally realizing its okay to come into herself. And the Melissa Beloist who plays Supergirl is PHENOMENAL in the role. She feels so authentic, and is so relatable as the quirky yet fierce Kara Danvers. She shows us that it is okay to make a name for yourself, have strong female role models like her boss Cat, and have a loving relationship with your family while still being strong. I appreciate that a lot. I don't think there is anything in this show that promotes this  feminist agenda  people have been so harshly degrading it for. Yes, feminism is present as feminism simply means equality of opportunity. But what's feminist about it is Supergirl's journey to find herself separate from Superman's shadow, having a female boss who has power and understands how to use it, and having a sister who is as rugged and strong as the male-dominated field of national security that she works for. Supergirl is nothing without her team of friends to help her, showing that its not being female that makes her strong, its being able to accept help from others and find role models in men as well as women. I love this show and I think it deserves a chance. There aren't many out there like this that are willing to put their ratings on the line to give little girls an opportunity to see that you can be a woman and save the world. ","9"
"Supergirl",2017-01-31," This show shouldn't be on TV. Especially with the other shows in Arrowverse that are really good, this just makes the whole DC universe look bad.The show is just a pathetic attempt to highlight 'Feminism' that is currently trending on media. This show lacks story, execution and the generic buzz. I would point out that Martian Manhunter is probably the BEST thing about this show. If you are a comic fan, this show is not for you. If you are somebody who likes TV shows, this show is not for you. IF you are here just to pass time, well there are worse shows out there.Wouldn't recommend though. ","5"
"Supergirl",2017-01-31," Stop making Supergirl look weak; Livewire should not be able to kill Supergirl with electricity; just ridiculous. And the way she gets beat up sometimes. I don't care the other aliens have powers too, for ....sake, she is a Kryptonia. Might as well take the show off the air. Her cousin, Superman, must really thinks she's weak. She's too girly too. She can be girly when on the job, but buff her up when she's Supergirl. The story lines are great. Can't wait to see why the one Alien in the episode that aired 1/23/2017 bowed to Mon-El. Thank you. Thanks for listening. Of all superhero's, Superman has always been my favorite. Maybe we could see a little more of Superman in her shows ","8"
"Supergirl",2017-01-30," In short, is Supergirl a must see? No, it's not. Watching it won't add anything to your life but on the opposite side, it won't take anything away either.The premise is interesting, and there aren't any Women led superhero shows so you have to take what you can get.It's not that it's so bad it's mind numbing. It could just be they are trying to be a basic show, but it starts off not making sense. *spoilers* Kara reveals she's an alien to a friend in the first episode because reasons. There was nothing pressing her, she just needed validation. I guess this makes her more human, but it also makes her a fool. The actual human heroes don't do this why does she? Then again, in episode 5 when trying to dispose of a bomb, she flies through the city instead of diagonally up and away from the city. So perhaps her characters is supposed to be a little... slow. But why does the woman hero have to be slow?As far as small problems, the show just introduces things and forgets about it. Like they will show the DEO posing as FBI one episode, and Kara being completely surprised by this the next, there being a mad bomber identified and his ex-boss (who is supposed to be a genius) walking right by him (not in disguise) but Kara's friend notices him from a far (there's more to this that makes even less sense), not to mention how the bomber go through security, the martian man hunter not using his powers effectively when he should or telling transparent lies the characters can easily check but he's oblivious, or the presence of other Kryptonians that have been on earth a while, but didn't go after Kara immediately nor can they easily handle her adult self in battle in spite of it being established that Kara isn't a good fighter. Or even robots going crazy for no reason loosing pieces of themselves that magically appear in the next scene because the doctor went crazy. *spoilers end* Just seems like lazy writing. The show is better than nothing and I'll continue to watch in hopes it'll get better. As long as you don't notice the little things then this is a great show. While I know there are many flaws in all shows, I don't care for them when they are this glaring. like when they are this glaring. ","5"
"Supergirl",2017-01-29," I have been a total super hero fan since I was 10. I was looking forward to this from the time I heard about it. DISAPPOINTED!. As they did in the later superman movies they seriously botched the costume. Supergirl's costume was sexy, this one is not. Seriously, black silk stockings and boots to the mid thigh? Further,she is not blonde as Supergirl is. Plus, she is a total wimp. I watched in dismay as a human punched her and knocked her down. I was equally dismayed when a crook grabbed a hostage and put a gun to their head while Supergirl stood ten feet away. She surrendered! Seriously, the character I am familiar with could have disarmed ten bad guys before any of them could pull the trigger, let alone one bad guy. The special effects are very good in my opinion. The best flying sequences for television I have seen to date. The settings are lavish and detailed. So it's not all bad. Thus the 4 out of ten rating.And now she has a ...gay sister... who is more capable than Supergirl herself as she has rescued her several times? And they both work for a  Martian?  Jimmy (James) Olsen is a masked avenger??? The same Jimmy Olsen who wore a specially made watch to signal Superman when he was in trouble? I think if you are going to make a series that follows an established story, by all means use creativity, But don't shred the original character for your own stories. Perhaps create your own character and put her in a world infested with aliens and dozens of surviving Kryptonians, put her in another dimension or another setting of some sort, but don't make her abilities change unless you have good reason to for the sake of the setting. People are drawn to the character as she is. Why else make a series about her? They made the same mistake with Smallville. For the first five to six years it was excellent as they stayed true to Superman, but then what happened to Superboy? As we all know, Superman went to his Fortress of Solitude right out of high school and stayed there for 12 years. Suffice to say the creators of Supergirl need to rethink what they are doing and get back on the  Super  track.I really don't mind the women's equality plug and the gay rights is OK to, but I don't think it should dominate the story to the point that it does. I know today's trend is toward  Girl  power and  Gay  power. So be it. My opinion is that they don't need to dwell on being politically correct to tell an entertaining story. And that's why the  super  fans watch the shows, read the comics, and spend millions at the movies, to be entertained. Final word, watch a few episodes and see if you agree, I'm finished with it. ","4"
"Supergirl",2017-01-16," I started watching the show because of @MelissaBenoist but now I'm completely in love. I love the characters, the story which means I love the writers, the directors, the actors and everyone involved with the TV show. The series is light, has comedy, drama and deals with contemporary issues. The two seasons are great and I honestly can not pick one or a favorite episode. The plots are great and the series deserves the third season, which will come in 2018. People can speak whatever they want because nothing changes the feeling of true fans of the series. So, I finish saying that who loves #Supergirl will continue to love and who does not love can happen to love a day or not. But that would be a waste, would lose the grace that the world has thanks to #Supergirl. ","10"
"Supergirl",2017-01-05," I ll start off by saying i never was a big comic book reader. As a kid I loved Batman (animated shows) and recently I stumbled across Arrow on Netflix. I was hooked. I watch all 4 shows and enjoy them for the most part. I don't care that the continuity is not spot on or anything like that. I like a fresh take on things a change here and there. I loved batman v superman and all the other dc films. But as good as this show is the PC crap needs to go. I have no problem with anything else. The show can be a great show! It doesn't need to tie in current events, politics, and racism towards white men. These things are getting old and people just want an escape from the world. You cant do that when its slammed back in your face every episode. I hope the writers get this hate out of there heart so i can enjoy a good show. Otherwise I ll just find something else to do with my time. ","5"
"Supergirl",2016-12-27," The best propaganda pieces all have one thing in common: the colors of its country's flag, claiming to be for patriotism, for America, even for world peace sometimes, in order to get its infantilized idea across, despite it being perceived as crazy by its target country, making no attempt to grow an audience of critical thinkers. I once said to an entertainer,  if you're gonna be wrong, at least be funny, Kevin  (I wonder if he actually read the message). Likewise, I want to tell the Feminist writers for Supergirl, that if you're gonna be wrong, at least be entertaining. Because Feminism is a dead-wrong idea- as many religions are. But feminist writers have created/taken part in amazing works of arts before:  Who Shot Johnny? ,  Jessica Jones ,  Mad Max: Fury Road , all beautiful creations I've read and watched twice. So is Supergirl wrong for having Feminist ideals in it? Nope. It was bad because:It was too friggin PREACHY!! You know how annoying and boring that gets?!?! It's free to keep its worldview of progressivism, but to just talk about it at random points without giving any good reason why...buzzwording, word vomit, pandering, virtue signaling, whatever, it's uncreative and therefore becomes BORING, which is the greatest sin a writer can commit. It doesn't matter if it's a show aimed at kids. They're kids, not idiots. Dr. Seuss is famous because he wrote messages that challenged both children and parents alike, while being under the guise of being a plain children's author. But writers nowadays only care about what SELLS easier more than what is GOOD, sometimes confusing the two as the same thing. CBS didn't pick up the character because she's actually good (she can be), they picked it up because there was a demand for a female feminist superhero, and Wonder Woman wasn't available (anymore). Supergirl has always been moldable. The viewing audience don't like her because she's good, it's because it's easy for women to fit into her shows (a blank slate, like Hannah Montana) and be as good as the big boys, all on a character that sports American colors, making it justifiable to boil down political/social issues into meaningless one-liners. Example:  She can't beat him.   Why, because she's a girl?  If by girl they meant 22-year-old with the mind of an adolescent, then yes. And sure, comedy is subjective...it was just never clever. The action was good until it became predictable. The older sister got lucky too many times, she should've been dead at episode 3. The plot was going somewhere good halfway through, then it just became a meaningless rehash of better show plots. Not much critical character examination. Way too much talk about meaningless romances. Character motivation wasn't always explained. Did they really have to make her appear great just because she was surrounded by weak people?I thought there were great moments in this show, *(spoiler alert): like when she was human for a day and at the risk of her life she convinced a robber to give her his gun. That was well-thought out.*Finale was mediocre. She didn't seem to care much for her Uncle, if that's where the struggle was.Maybe they did have a heart set on Supergirl...but they just treated even their target audience as stupid children who were gasping for self-esteem like they were running out of oxygen.  You can do it, because you just can!  What is that going to add to society? Is confusing impressionable young girls with identity politics gonna help anyone?This needs to be categorized in the same group that God's Not Dead 1 and 2 are in: Preachy, Propaganda, Rehashed pieces. Supporting this show by giving it high ratings or buying it when it comes out on DVD is sad (call it a guilty pleasure if you must), because this does nothing for the world except make people believe an ideology without actually thinking about it. I. Whatever entertainment value it has will be in your mind short-term; but It's mind-block on critical thinking can last a long time. At some point, Supergirl's High Priest, Cat Grant, said to Supergirl and The Flash and friends,  You all look like the cast of a CW TV show,  and the music and conversation played on as if it was hilarious. And I cringed so hard that it made me look to heaven, bend my knees against the wall, and say,  Lord, I must castrate myself. This world is too stupid now, I must castrate myself before it becomes worse.  And castrate themselves they should. ","3"
"Supergirl",2016-12-19," This show started out reasonably well in S1, with a few interesting characters to develop and a believable premise. Kara did the odd silly thing but the fact that she was new to the idea of the public eye could explain at least some of it.Now in S2, however, the writers actually expect the audience to believe that someone from Krypton, home to an advanced society where the likes of space travel was a commonplace reality, is a bona fide idiot.She'll willingly submit to three humans, all close enough to her to swat with a light backhand, because someone they have no hope of harming before she gets them all is supposedly under threat. She'll wait 5 seconds for a weapon that can harm her to charge, and give its wielder time to fire, despite him not being more than two metres away from her. She'll hover above perpetrators wreaking havoc so as to give them the opportunity to spot her and fire at her, rather than just go in and take care of business.She has also lost any and all reflexes she may have once had. I fear that's it for me in terms of Supergirl. It is simply too frustrating to watch. ","3"
"Supergirl",2016-12-14," (minor spoilers) Supergirl and Jimmy Olsen ? what a joke. No chemistry between them. Not even a real romance scenario outside  clichés . It's only there for anti-racist agenda. Why does Supergirls like Jimmy ? nobody knows ... ho wait, he has abs ! It's obvious when Blake Jenner her real husband in live comes in the show, suddenly, there are sparks. We hope that he stays but ...The show is obviously for teenager. Bearly watchable, even if getting a little better with time.No real innovations, no suspense even when there is a countdown.Good fun moment with Barry Allen. This episode, we feel like the actors are really having fun. ","3"
"Supergirl",2016-12-08," I have to say this. I know people may not agree, but I certainly think that this show is terrible. If you have watched Arrow and Flash, you will see the same set-up. Computer person, hero, hero's ally, persona, etc. Its the same formatting. Its just a combination format of Flash and Arrw. This show is way to cheesy, and only my 10 year cousin likes this show. This show doesn't live up to Arrow's first and second season or The Flash. If you want another hero show in the Arrowverse, try Legends of Tomorrow. Its not THAT great, but it definitely gives you a cozy vibe, rather than this, the same old same old. The main character doesn't even make sense most of the time. ","1"
"Supergirl",2016-12-01," As so many others here, I really wanted to like this series. Sadly, it's become nothing more than a millennial vehicle for the religion of AGW, rabid, yet sometimes stealthily introduced third-wave feminism, case- studies for the New Castrati metro-boyz, over-the-top cheesy-puppy dialogue, and overt lesbianism that has absolutely nothing to do with any workable story-line and serves only to push the identity politics and agendas of a studio management that dreams of a world comprised of diverse-for-diversity's-sake nightmare Enterprise bridge crews. We watched every episode, overlooking the mediocre acting and PC-ness as a simple act of escape-ism. But, we saw that as the second season unfolded, this silly show wasn't going to make it, alas and alack. When the producers and check-signers decided to actively use what could have been a really fun show to promote their own, tiny-fringe beliefs onto the rest of us - you know, the people who watch the adverts and spend the coin - it was time to switch it off and look elsewhere. So-called  progressive  propaganda and latent sexual identity issues indoctrination has no place in what is purportedly pushed as a prime- time kids and young-adult TV show. But, then again, that is how the left gets things done, isn't it?As the title infers, for us and many other people I've talked to, Supergirl jumped the shark in season 2, starting at episode 5.Too bad. It really could have been a fun ride. ","1"
"Supergirl",2016-11-30," Okay, I've read the reviews too.. My main complaint is that the writers seem to never have read any of the comics. Apparently unfamiliar with what the title  Super  refers to, they put an otherwise promising character into the most absurd situations. Supergirl is very nearly as strong as Superman, yes, but she is also just s fast. That means super- speed. Does  faster than a speeding bullet  ring a a bell? I watched as Suppergirl just stood by and watched a switch thrown in this last episode, the one used to activate the killing weapon. Just stood there as if she couldn't move. This is just bad writing, you writers. Super- speed, get it? She could have been there before that switch was thrown easily. Think of how the Kryptonians moved in  Man of Steel,  or  Smallville.  That's how Supergirl should move. Her reflexes match that. It's almost impossible to take any Earth-resident Kryptonian by surprise. So get with it. There are other plot devices which would be infinitely more interesting if writers just dealt with the character's powers instead of hobbling her this way. And, yes, this is written immaturely and unprofessionally. You don't have to write down to kids in the audience. They appreciate the mote intelligent story lines, so give it to 'em and save everybody the pain of watching these episodes. ","4"
"Supergirl",2016-11-29," SPOILERS (for anyone that hasn't watched the 11/28/16 episode)!No wonder CBS sent this turkey over to the CW station! OK. My kids love 'The Flash' TV show. It is really interesting (outside most of the soapy 'love stories'). I even like it to a point. However, the so-called  cross-over  episode pretty much spelled the death of 'Supergirl' show. Granted, I really haven't seen many episodes (the ones I have BORED me and my children), but with the much hyped event this week, I decided to see what was in store for 'The Flash'. Well, what was the  cross-over ?!? An out-of-place scene that looked to have been conveniently stuck within the episode (at the end?). It seemed to have been shot BEFORE any of 'The Flash' episodes this season. Uggh! So everyone sat through the entire episode? You mean little kids and teenagers whose parents aren't watching all of the lesbianism/out-of-closet/two-women-kissing scenes were subjected to that CRAPOLA? Really, CW? Luckily I was in the room and changed channels when the lesbianism poured through the screen! Yes, the CW decided that the series was not even worth the effort that it put 1 1/2 minute  cross-over  at the very end of the 'Supergirl' episode! That's right, ratings must be SO BAD that lesbianism for nearly 10 WHOLE MINUTES was MORE IMPORTANT for ratings than anything else! Wow!This episode should mark the death of this series on television! I will NOT return! Beware if you have small children, too. It is unforgivable to have them subjected to social issues that they have no business having to watch! ","3"
"Supergirl",2016-11-25," Season 1 had a very slow start but it did hook me in and encourage me give it a chance. Right from 'Go' it was campy, cheesy, cringe and quite frankly the last show I watch in my weekly lineup but at the end of the day I just had fun with it.Yes there is a strong female empowerment vibe going on, what with God and the US President being called 'She' by the characters but so what if it's a little feminist sometimes? It isn't stealing from the fun factor at all and her reason for deciding to use her powers for the first time in years was valid and the reason she kept doing it was because of the rush she got from helping people.Her reason for helping people is self gratifying, no doubt, but with all that risk and no reward I would at least want to feel good about doing it and when she fails on more than one occasion due to a lack of experience she does feel bad about it.The best character has to be Cat Grant, her bitchy but wise personality is perfectly written (thought not always expertly acted) and when she does be a little nasty she isn't doing it to be mean but to encourage self improvement in Kara's human life and by god thank you for making her wise without being all knowing.Jimmy Olsen however is a hit and miss, yes he's black when Jimmy is white but he's also just there for no reason except to be the Superman guy without including more major characters from the Superman franchise who would potentially steal the show. Even Quinn has a role with the group but all Jimmy has done is drop Superman franchise names and give advice. He isn't necessary yet but at least he isn't badly written.All in all I missed the cheesy Monster (or Alien) of the Week trope because lately it's been about dark tones with lots, if not excessive amounts, of gore.It isn't amazing but it's fun and Season 2 is, so far, better than Season 1... ","7"
"Supergirl",2016-11-24," In average it takes two or three episodes of a TV series for a person to love it or hate it, if by episode four you're not into it odds are you better watch something else... this one however, won me over from the pilot!The premise of Kara Zor-El trying to be her own hero and not just live under her cousin's shadow is astounding, but it wouldn't be anything special if it wasn't for the amazing talent of Melissa Benoist, who gives Kara such a humanity that is almost unprecedented even for the Comic Book genre, Benoist is so sincere when she plays the invincible Supergirl and at the same time the vulnerable Kara Danvers. But it is not just her, the whole cast is incredibly talented, and the scripts are sophisticated but emotional, the photography and FX are above average TV, it is really an incredible show to watch.The Geek fandom gets a bad rep when it comes to accepting female Superheroes, and the divide amongst the fandom caused by certain movie that should not be named didn't help. But in reality as a proud member of the Geek community I can attest that we absolutely love empowered female Superheroes; we live in the era of amazing female characters coming to life, characters like Black Widow, Jessica Jones, Wonder Woman, Quake, Melinda May... and now we have Kara Danvers, who is an amazing addition to the golden era to be a Geek.THIS is how you make a Superhero TV show, this is how you make an alien from another planet likable (I'm looking at you, Zack Snyder), this is how you make people believe that a woman can fly. ","10"
"Supergirl",2016-11-23," Bad acting, terrible writing, horrible CGI. Unless you're a 15 year old feminist, you probably won't like this show. There are parts of a few episodes that ate entertaining but for the most part its tough to get over the corny one liners, and bad acting. Its obvious goal is propaganda, when it should be about telling the story of DC hero's Like I said I would recommend it to a audience of 15 and younger. Traditional DC fans will not enjoy what they are doing with this show. I can't understand how thy can do a good job with the Flash, and the first few seasons of Arrow, but seem to not give a true effort with this one. ","1"
