"Show","Date","Review","Rating"
"Supergirl",2016-03-30," Super girl is a brand new spin on the character. Being in the same universe as Flash and Arrow, there is a lot of enjoyable scenes and great lines. Melisa Benoist is great playing the girl of steel. There are some dry scenes, especially the romance scenes. The rest of the cast is very astonishing. Everything from Toyman to Indigo are great villains. Some aren't the best. Like Livewire, but she is a OK character. Overall the series is amazing, a fun mixture of Flash and Batgirl.The series is connected to the Flaroww verse, but is located on Earth-3. I would love to see a season 2, even more on Legends of tomorrow. ","8"
"Supergirl",2016-03-29," First 3-4 episodes are awful, but if you manage to resist the temptation to quit watching you might find yourself astonished by the direction this show took.As stated, the first few episodes present some of the most cringe worthy, cheesy and strained TV moments I've ever witnessed. First thing people notice is Supergirl's appearance and Melissa Benoist is a cute blonde cheerleader type of a girl. Mix that with a female dominated cast and corny dialogue and you get a chick flick for 13 years old girls. Luckily, someone in the production recognized this problem in time and successfully pointed in the right direction.From that point on the show continued in decent manner. Adding little mystery and emotion to characters made them more likable, balancing the story arcs, character relationships and pace made it entertaining to watch.Give it a try past first few episodes and then come up with your own conclusion! ","8"
"Supergirl",2016-03-29," Melissa Benoist does a great job at giving Supergirl and her civilian character Kara, some identity. I've read a lot of Supergirl comics and watched all incarnations on cartoons and movies. Her identity seems to be: that she has no identity (mostly in relation to Superman). So that's where Melissa succeeds. She is adorable as awkward Kara and convincing as cool, strong Supergirl.Her supporting cast is strongly portrayed: Jimmy Olsen is OK, her sister is really good, and Jonn Jonzz is awesome. I still find Calista Flockhart super weird but since she is often on Supergirls side, I will root for her.The show is comparable to the Flash, with many cameos, heroes and villains, which gives you great bang for your buck. Something they did in the early episodes was end the show with Kara IM'ing with Clark Kent in Metropolis. I loved this familial interaction! I don't understand why they have to live separate lives. Wish they would keep doing this.I like how not every episode is according to formula, where we watch Supergirl get beat up by a new villain, they find a solution, and they win. I liked the episode focused on Jonn Jonzz, giving Kara a break.Supergirl is just a good a show as Arrow, Flash, or Agents of Shield. DC's only miss so far is Legends of Tomorrow. If CBS doesn't renew it i don't understand why the CW wouldn't. We need you Supergirl! ","9"
"Supergirl",2016-03-29," To be honest! I don't consider it as superhero movie. last episode I watched because of flash and I just stopped watching it after first 3 episode! I think there are big major mistakes like.1- Poor Story line. (No one want to see the aliens more) 2- Poor Acting (female character is really not charming and attractive for this role) all other supporting role are also facing similar problem)I think! this series will be cancelled anytime. really messed up when there is great series like arrow and flash. Simple! Change the Actors in this series and you will get some chance to get some reputation. ","1"
"Supergirl",2016-03-26," I grew slowly but steadily into a fan of series Arrow, Flash, Dc legends of tomorrow. And Supergirl could not miss from this basket. It's true that the first episodes are targeting apparently the female young viewers, with girly issues and romances. However as the show develops, its characters gain in depth and interest while introducing at the same time other classical Dc characters. The woman ruled environment may annoy male audience, only until they realise the eye-candies that are hiding behind a secretary desk, a uniform, or some tights. I ended up preferring it over the now Felicity-ruled-Arrow and became my 2nd favorite after Flash ","10"
"Supergirl",2016-03-25," When I first started watching Supergirl, I couldn't help but roll my eyes at the heavy handed female empowerment message and the somewhat cheesy writing. Don't get me wrong, I'm all for female empowerment, but it's really not necessary to bash us over the head with the same message every five minutes every episode. Really. We got it the first time. Due to the cheesiness of the first episode, I wasn't sure that I would keep watching. The characters were struggling to find out who and how they were and it was a rough start with inconsistent writing, to say the least. However, just out of curiosity's sake, I decided to watch the next episode. And then the next. And then the next. Thankfully, each episode is better than the last- the dialogue is better, the message is more subtle, the characters have found their place. I highly recommend that you stick through the first few episodes, I promise it gets better and it's worth the effort! I'm really looking forward to seeing where this series will go. I think it has a lot of potential, and I'm glad to hear it has been renewed for a second season! I hear there's going to be Flash crossovers (and hopefully some Emerald Archer ones?) too. We are literally living in the best time for superhero movies and TV. All in all, so far, Supergirl is great, fun, family friendly, evening entertainment! 7/10 stars ","7"
"Supergirl",2016-03-24," Supergirl may have started roughly but as the weeks go on, the show really starts to find its footing. It is a light hearted show with great actors. At times, the writing can get a little clunky but Melissa Benoist, Chyler Leigh, Calista Flockhart, and Laura Benanti really bring a lot to it and many times show more through their acting than words. The female relationships on the show are incredibly important and worth following as the show develops. Calista Flockhart is truly a gem that brings levity to every scene she's in while also portraying a complex women with a checked past that wants to help her protégé learn and grow. I would highly recommend this show to anyone who was looking for a fun, family friendly, superhero drama ","10"
"Supergirl",2016-03-24," I binge-watched all 17 episodes in less than a week and let me just say that I love the dynamics between the female characters in the series- this includes the not so friendly ones found in the likes of Astra, Siobhan, and Livewire. I love that most of the women take up space and are powerful and are three-dimensional. Also the POC are not background characters and call the shots too; I'm heart-eyes for James Olsen, so fond of Hank, and in awe with Lucy. The acting is ace as well. Calista Flockhart is simply phenomenal, Melissa Benoist is just inspiring and I want to take her home with me! Chyler Leigh too deserves a shout out because Alex is so badass and at the same time huggable. I love that this show is so positive and also manages to bring up issues that deserve to be talked about. I'm looking forward to what happens next and I hope we get a Season 2! ","10"
"Supergirl",2016-03-24," I've seen so many reviews bashing this show as being too tropey, too silly, and my personal favorite, 'too feminist'. As if comic books themselves aren't tropey and at times, silly. In the same breath it's accused of being too radical. A black Jimmy Olsen? How dare they? Supergirl's hair isn't blonde enough? The scandal! Here's the thing about this show. It's far from perfect. The pilot, at times, felt like a kid high off candy - too excitable to be charming. The first few episodes stumbled through a plot. Writing has been somewhat inconsistent, and yes, characters have been changed from their traditional comic-book origins. But the show has been consistent with one thing - it captures the essence of Supergirl. This isn't Arrow or Gotham, where Man!Pain fuels the story along. It isn't supposed to be. This is the story about a young woman coming into her own. Of course it's going to have a strong feminist angle. After years of listening to whiny male superheroes, I'm delighted that we finally have a hero, dealing with balancing what it means to be a woman with what it means to be a superhero. This is designed to be a show that parents can watch with their kids. That doesn't make it infantile or immature, but it does mean that it's going to be lighter than say Arrow. This isn't a bad thing.The show has been consistently getting better. It does a fantastic job of showing off the Superman mythos, while keeping it about Kara, reminding us that this is her story. It has a great cast of women.Melissa Benoist absolutely captures Kara's dorky persona, as well as the strength of Supergirl. She's a revelation, after watching so many heroes brood on our screens. Calista Flockhart is not just the bitchy boss; she's shown to care deeply about National City and Supergirl herself. She plays the role with so many nuances, it's fascinating to watch. Chyler Leigh, who plays Kara's sister, Alex is equally engaging, and it's refreshing seeing a cast of female characters who aren't sniping or plotting against each other. This show might have taken a while to find its feet, but it's getting there, and the ride has been an enjoyable one. This show has become charming and sweet, and quirky and everything I would have expected from Supergirl. It focuses on hope and friendship and family and why should these values be ridiculed just because they're championed by a girl? ","8"
"Supergirl",2016-03-04," Lets make this short. This series started out a promising, then it degenerated into a drama feast. The drama got so heavy that i had to put my hand on the fast forward on the remote control continuously.This series is so cheap that it even fails at being a soap opera (with shitty action scenes).I thought this series was to be an action and adventure genre, the crying and emotional roller-coaster always got me cringing my teeth.I rated this show high when the first episode came out, however I was totally disappointed when the other episodes came out.Please if you want to keep your emotions intact stay away from crap like this. ","2"
"Supergirl",2016-03-02," The show started off rocky. The pilot was terrible but I decided to continue watching it because my 2 daughters liked it. It does have a 'girl power' theme and a very strong relationship driven story, which I love and I feel is very positive for my girls. All the characters grew into their own skin probably around episode 6 and after. From then on, it was very enjoyable to watch. Melissa Benoist took a while but got into her role, there was a lot of key moments that showed her acting props - showing vulnerability and strength at the right moments. I'm gonna keep on watching this as I'm getting really fond of all the characters - even the passive aggressive Cat Grant - which may not be Calista Flockhart's greatest role, but an interesting one none the less. ","9"
"Supergirl",2016-03-01," i actually looked forward to this show when i heard it was going to be on c.b.s. but what i got was the worst form of TV, basically just a agenda of how we all should try to live together, doesn't matter if you are a alien with 4 eyes ,or you are pink with purple spots.then we got the supergirl herself-who has to be one of the worst actresses in the world.the plots are down right stupid. in this version jimmy is a black photographer who knew who superman was.calista flockhart as the mean ole editor,but she is really not that mean.like a movie this year called fantastic four, they changed so many items from the original supergirl, and made it a love story, why in the hell can you not have a story which is only about supergirl-no supergirl 7th grade love life?this show sucks big time.1 of the worst on TV.remember batman from the 1960's why cant you have made super girl more like that-fun,but not a 7th grade romance. ","1"
"Supergirl",2016-03-01," So I saw a lot of people giving it a bad review just by watching one or two episodes. I completely disagree to them. The show is getting better by each coming episode. They need to work on visual effects a little, but apart from that I am really enjoying it. I suggest people to watch it as it is actually going good and slowly gaining pace for further seasons. Also a lot of crossovers are there to come soon as DC is bringing multi-verse to the TV and thus I am hoping for it to become more fun very soon. From acting point of view, everybody seems to be doing a brilliant role. Melissa Benoist has shown great potential as Kara and as Supergirl. Calista Flockhart is doing a brilliant job as Cat Grant.In short, a series worth watching. ","9"
"Supergirl",2016-02-26," Go ahead and watch the show. I desperately tried to like it but there is so much to not like. Utter garbage. The show prides itself on being true to the comic and not being biased.When in reality its the opposite. Clearly the jokes are based off of recent one liners you hear from high schoolers. This will surely embarrass any true fan out there to the superman series. Just a heads up to all who believe it would be good its just an attempt at making the other audience (women) feel like they are important too. Ladies you are important believe me. We never said you weren't. But good god this isn't the way to get anyones attention other than to change the channel.just watch and be amazed.Awful job guys. Awful. ","1"
"Supergirl",2016-02-25," I thought this might be a good show but there is only so much political reeducation dogma you can smuggle into my house disguised by a cute young girl in a superhero mini-costume. There has been quite a bit recently but in the latest episode the un-freckled and un-redhead Jimmy Olsen castigated Supergirl for  running her own private Guantanamo  which was not only a pretty harsh falsehood, was politically timed dogma. Supergirl did not even stand up for herself but instead caved...because everyone is supposed to automatically agree that Guantanamo = bad. Never mind that it's not her department (she's not in charge). She doesn't own the lock-down which is run by the government to secure dangerous aliens. Never mind that she can't shut it down and should not be responsible for releasing anyone, she completely was blamed.Ultimately in the story she was the one that had to act. She releases a dangerous criminal to the streets because holding him even with the 'room full of criminal case files against him' was  wrong . OK, I'm willing to stipulate that holding US citizens without due process is wrong.. but you don't do what our president does and release dangerous people to the streets to make a political statement. They need to be tried and if convicted go to prison. That's what you do with US citizens who break the law and for whom you have collected a preponderance of evidence to convict. Notice they did not address the alien terrorists which there evidently were quite a few. Can you imagine the disaster releasing alien terrorists to the streets would cause? Yep they didn't address this because even they know this would be a no win for them.It's a minor point but it's enough to be annoying. Watching the show I felt compelled to stop the show and teach my kids why what Jimmy Olsen said to Kara was wrong. Please try not to teach my children incorrect principles. thanks a lot Supergirl. ","4"
"Supergirl",2016-02-25," I really want to like this show. It has some great moments and a likable lead. That's the good side, now for the darkside:1) Please, please, please try to keep the plot holes from multiplying like rabbits on a diet of Viagra. Example: the first episode where Supergirl meets her evil aunt, she thinks she is her mother, but learns in a bit of  evil guy dialog  that she is her aunt that she was never told about. A few episodes later we find out that Kara and her aunt were once the best of buds... what the Hell. 2)Preach it baby. This show is very much in tune with women rule and boys drool, especially white boys. ALL the major villains are white guys full of  white privilege . General Lang, Mr. Lords, Nom(the real Kryptonian villain as his wife - Kara's aunt - is really a good person inside), the Trickster, all evil white guys. The heroes are selected from a college course on women and minority studies. I have no problem with heroes being of whatever color or gender. I do have a problem when the show gets preachy about how white guys are evil and stacks the deck in such a way that it is painfully obvious. The only sympathetic white guy is a nerd and even with that his dad is evil. 3) Too much suspension of belief. Not the lasers coming out of Supergirl's eyes. The fact that she would love her job working for Han Solo's wife (Flockart)who plays an utterly detestable character who has the heart of the Grinch, Donald Trump's narcissism and Hillary Clinton's bitchy I can do no wrong attitude. Sometimes it is funny how over the top she plays the role, reminds me of Shatner's acting skills. 4) Why are they ruining the role of Jimmy Olsen? In NO universe is Jimmy a highly confident tall muscely black man. Where is the awkward red head with freckles. I'm sure they did this because this show is more concerned with appeasing the PC gods (see #2). Sad that they could not be a bit truer to the source material. Will I keep watching the show, maybe. I do get tired of the disjointed plots and every show learning about how evil white guys are, but it does at times redeem itself. They better move their low bar a little higher and soon. ","4"
"Supergirl",2016-02-24," Supergirl aka Kara Zor-El is supposed to be 16 years of age by the time Superman is 29 years of age in the comic book storyline their following as in the movie 1984 Supergirl movie Helen Slater was 20 years of age playing a school girl while Christopher Reeve was in 30'sThe title is just wholly sexist title for the series just makes your blood boil, Just call it Super Women, they try to use a get out of jail clause by using the female magazine editor Calista Flockhart create the name in story saying she created Supergirl not Otto Binder from DC in 1959! Overall Melissa Benoist is too old play SuperGirl but old enough to play Superwoman !The TV series lacks total originality is just blatantly ripping off Superman story if your just going to replicate Clarke Kent mild mannered reporter with Kara Danvars.Smallville clone would have been better story vehicle inspiring young girls who get bullied in school and courageously turning the other cheek, similar to Joss Whedon's Buffy Vampire slayer ","2"
"Supergirl",2016-02-24," With an influx of superhero TV series and movies, I was excited to see a show that features a female superhero.Unfortunately, after watching 3 episodes of Supergirl, I couldn't watch more of this garbage.As much as I appreciate family orientated television series, it's a fact that family-friendly theme and excellent acting/dialogue are NOT mutually exclusive!The plot is too uninspiring, and the characters are dull, immature, and lacking in sophistication in some form of character development. It made no sense that a group of 20 year old are behaving like egocentric school age children.The scripts are terribly written, acting is cringe-worthy, CG seems outdated, and the overall execution is very disappointing.I really wanted to like this show, but there is just too many things to dislike about Supergirl. ","1"
"Supergirl",2016-02-23," The show is absolutely awful. Promised a female hero, and instead we get a whiny female teen who needs government handlers to tell her when to blast meaningless baddies Superman is conveniently too busy to handle with her eye lasers because apparently, she can't even make that decision without consulting with someone.Those are, by the way, my fiancé's words on the show. She absolutely loathes it. In fact, she watches Skorpion some nights, but will change the channel when Supergirl starts and change it back when its over.The problem is the writing. The show is really, really awful. The dialogue is cheesy; the villain of the week flavor structure is sad and renders any bad guy meaningless. Changing Jimmy Olsen the way they did also irked me, personally <U+0096> not because they made him black <U+0096> I could care less about the skin color of the actor <U+0096> but because apparently, the bespectacled, somewhat clumsy yet lovable Jimmy Olsen somehow wasn't good enough for this cast. And let's not forget all that talking about FRIENDZONE<U+0085>. Seriously? Can this show be more immature than that? I'm not against memes, sometimes they can be fun, but to see grown ups talking about friendzone in the work place makes me think if the script for this show isn't actually being made by teens, who can't even read aloud what they're writing.Now about the female example of strong and independent woman, I think Supergirl isn't even trying. I would watch a show about Felicity Smoak alone, instead of Supergirl. She has the character, the presence and personality you hope to see in a fictional being, everything needed to make her more believable, while Kara <U+0096> although I really like the actress herself <U+0096> has even less personality than the heroes from Teen Titans cartoon.Oh, and one last thing: After watching Daredevil on Netflix and seeing the clever tie-in to the Marvel Universe used to explain his uniform, and how he went about getting, the lets-play-dressup method for the two person committee who designed Supergirl's costume in the pilot was laughably pathetic. It was, once more, my fiancé who first pointed this out and I agreed with her immediately. ","1"
"Supergirl",2016-02-22," First Off the veiled racist outrage at a Black male on White female Interracial romance is hilarious to me. That aside I love the show. Melissa Benoist plays Supergirl in a way that is very balanced and has a wholesome innocence in her delivery. The whole cast are really good actors but for me the action sequences and introduction of new Villain's each week is the real star. I hope Supergirl and Jimmy's romance gets hot and heavy if for no reason but to introduce people to the 21st Century. I'll admit I also watch to see where it goes. I hope they get renewed because I look forward to seeing the new alien or villain they will face each week. i also like the fact that not every problem requires a hammer. Supergirl is well thought out. kudos to the Cast and crew their work is appreciated. ","7"
"Supergirl",2016-02-16," Green Martians? And now White Martians too? This show is great except for above. Too much suspension of disbelief required when we've got a bunch of rovers on Mars showing no life! Krypton and other distant fictional worlds are fine. But if you include a world we know a lot about (Mars) and say these sentient aliens with powers came from there and offer no further explanation...then it's just dumb! If you want to blur the lines between fact and fiction...you got to do it right and make things seem plausible like in DaVinci's Code. Just putting a green Martian into the show out of the blue is insane. Yeah it might have a background in comics, but many viewers don't read comics. ","8"
"Supergirl",2016-02-12," It is great to see a TV show with women of power at its center. Despite the fact that Calista Flockhart has the tendency to look slightly non-emotive in certain scenes, due to the lack of movement in her forehead region, she still manages to pull off the queen of media empires quite well.Melissa Benoist's performance as Kara proves that a woman can be central to a television series while still being seen as something other than a sex object.I, personally, am quite the fan of the feminist undercurrent this show has to it, despite the claims of other reviewers on this site. I also like the fact that we are not subjected to an exact copy of the comic book whereby we are forced to stick to a lovely format. But God forbid someone to be black and bald instead of white and ginger. But lets face it, you'd complain if this show were whitewashed to oblivion too. ","8"
